13201;ESTUDO SOBRE EMPREENDEDORISMO CORPORATIVO NA EMPRESA REALCE CAL«ADOS GUARABIRA-PB;KATARINA  LACERDA, LUCINALVA HOR·CIO RODRIGUES;IFPB;CI NCIAS SOCIAIS APLICADAS;ORAL
13123;LIXO ELETRONICO: UM DOS GRANDES DESAFIOS DA SOCIEDADE ATUAL;ADRIANA SANTANA FERREIRA;IFAL;CI NCIAS HUMANAS;BANNER
13083;DIAGN”STICO AMBIENTAL DO RIO CORRENTE NAS PR”XIMIDADES DO PERÕMETRO URBANO DA CIDADE DE CORRENTE - PI;ANA VALÈRIA ALVES RODRIGUES DO NASCIMENTO;IFPI;MULTIDISCIPLINAR;BANNER
13075;DIVERSIDADE NAS ORGANIZA«’ES: UMA REVIS√O DE LITERATURA;MONICA  ALMEIDA GAVILAN SANTORO;IFRN;CI NCIAS SOCIAIS APLICADAS;ORAL
13071;ESTUDO DE IMPACTO DE VIZINHAN«A DO CAL«AD√O DA PRAIA FORMOSA EM ARACAJU/SE;DANIELLA  ROCHA, JOCIMAR  RODRIGUES JUNIOR;OUTROS,  UFS;CI NCIAS BIOL”GICAS;BANNER
13070;PRODU«√O DE MUDAS DE TOMATE CEREJA COM SUBSTRATOS ALTERNATIVOS;REINALDO DE ALENCAR PAES;UFAL;CI NCIAS AGR¡RIAS;BANNER
13056;PROPOSTA DID¡TICA DE PRODU«√O DE VÕDEO DE EXPERIMENTO DE QUÕMICA POR ALUNOS DO ENSINO M…DIO ñ ESTUDO DE CASO DO IFCE - UMIRIM;ANA PAULA AQUINO BENIGNO, ANTÙNIA HARESSA OLIVEIRA DOS SANTOS, JOSÈ DAVI FERREIRA DA SILVA NOGUEIRA, PAULO CESAR COSTA DE OLIVEIRA, REBECA DE CASTRO SALES;IFCE,  OUTROS,  UFAL;CI NCIAS EXATAS E DA TERRA;ORAL
13050;PRESERVA«√O DA CULTURA INDÕGENA ATRAV…S DO ESTUDO E DIVULGA«√O DA CULTURA ESTELAR TUPI-GUARANI;ANNA LETICIA DE LIMA SILVA;IFPB;CI NCIAS SOCIAIS APLICADAS;BANNER
13046;UM RELATO DE EXPERI NCIA DE UM MAPEAMENTO DE COMPET NCIAS NO IFPB;FAUSTO VERAS MARANH„O AYRES, MAXWELL IELPO DO AMARAL;IFPB;CI NCIAS SOCIAIS APLICADAS;BANNER
13035;A EDUCA«√O PARA AL…M DA SALA DE AULA: UM RELATO DE EXPERI NCIA EXTENSIONISTA COM ALUNOS DE ESCOLAS P⁄BLICAS DE MACEI” EM MUSEUS DA CIDADE;B·RBARA  DOS SANTOS LOPES, DANIEL  CAVALCANTE DA SILVA, SOLANGE  ENOI MELO DE RESENDE;IFAL;CI NCIAS HUMANAS;BANNER
13026;A ESCOLA DE APRENDIZES ARTÕFICES DE NATAL E SEUS SERVIDORES: UMA AN¡LISE DE PERFIL (1909-1937);JENNEFER LARISSA  GUEDES DA SILVA, RENATO  MARINHO BRAND„O SANTOS;IFRN;CI NCIAS HUMANAS;BANNER
13010;UM ESTUDO SOBRE OS ERROS COMETIDOS POR ESTUDANTES NA RESOLU«√O DE EXERCÕCIOS DE PROGRAMA«√O;BRUNO  CALDAS, DANIELLE AMARAL MENÈNDEZ, METHUZAEL  RODRIGUES, PRISCYLLA  SILVA;IFS;CI NCIAS EXATAS E DA TERRA;ORAL
13008;EDUCA«√O EM SA⁄DE: ABORDANDO PRIMEIROS SOCORROS EM ESCOLA P⁄BLICA NO INTERIOR DE ALAGOAS;ALDO  DA SILVA OLIVEIRA, JOSÈ EDMILSON  LACERDA J˙NIOR, MARIA  JOSE DOS SANTOS BARBOSA OLIVEIRA, MARIA LEYLLANE  MACENA DE LIRA;IFAL,  OUTROS;CI NCIAS DA SA⁄DE;ORAL
12996;A DESINFORMATIZA«√O DOS EMPREENDIMENTOS HOTELEIROS NO MUNÕCIPIO DE CANIND…-CE.;ALINE SANTOS FERREIRA, CARLOS HENRIQUE LEIT√O CAVALCANTE, MARIA CAMILA SANTOS MARTINS;IFCE;CI NCIAS SOCIAIS APLICADAS;BANNER
12994;EDUCA«√O EM SA⁄DE SEXUAL PARA ADOLESCENTES SURDAS, ENTRE O SIL NCIO E A INFORMA«√O;MÈRCIA ALC‚NTARA FEITOSA VALENÁA, RONNY DIOGENES MENEZES, BRUNA KARLLA DA SILVA CAMPOS;IFPE;CI NCIAS DA SA⁄DE;ORAL
12993;AVALIA«√O QUALITATIVA DO INDICADOR DE TR¬NSITO EM CIDADES INTELIGENTES BASEADA NO MODELO DE MATURIDADE BR-SCMM;ISSAC ROBERTO FERREIRA, MARCILIO  SOUZA JUNIOR;IFAL;CI NCIAS EXATAS E DA TERRA;BANNER
12987;LEIHMANIOSE TEGUMENTAR E TENÕASE: A PREVEN«√O ATUANDO COMO M…TODO PARA A TRANSFORMA«√O NO COTIDIANO SOCIAL, CANT¡ -  RORAIMA;RAYANE SOARES CASTRO;IFRR;CI NCIAS DA SA⁄DE;BANNER
12985;INTERC¬MBIO NO ENSINO T…CNICO INTEGRADO: UM ESTUDO DE CASO DO IFBA, CAMPUS DE SALVADOR;CL·UDIO ALBUÈS ALVES DA SILVA, LORENNA  SANTOS VILAS BOAS, LUCÈLIA  RAMOS ALC‚NTARA, MATEUS  BARBOSA MACHADO;IFBA;MULTIDISCIPLINAR;BANNER
12964;TECNOLOGIAS ALTERNATIVAS PARA APROVEITAMENTO DE ¡GUAS NO SEMI¡RIDO;KATHARINE TAVEIRA DE BRITO MEDEIROS, LUANDA MARIA SOUZA DA SILVA, NATAELY PEREIRA DA SILVA, T·SSIA  MELO;IFPB;ENGENHARIAS;BANNER
12963;TUDOVALE - GERENCIADOR DE DOAÁıES ONLINE;HUGO NUNES DE FREITAS, JHEYSSON SANTANA DA SILVA, NIVALDO  CARVALHO DE SOUSA, RÙMULLO MORAIS MAIA;IFPI;CI NCIAS SOCIAIS APLICADAS;BANNER
12959;DETERMINA«√O DE MINERAIS EM ¡GUAS NATURAIS MINERAIS COMERCIALIZADAS EM PETROLINA-PE;TATIANE  DE OLIVEIRA XAVIER MACHADO;IF SERT√O-PE;CI NCIAS AGR¡RIAS;BANNER
12957;CONSELHO MUNICIPAL DE ALIMENTA«√O ESCOLAR: UM ESPA«O DE REPRESENTA«√O SOCIAL NA GEST√O P⁄BLICA;EMANUEL  JUSTO, FABIANE PEREIRA DE SOUSA, IDELFRAN DA SILVA EUSTAQUIO, LUMA KRISCYA CO LHO DE SOUSA;IFMA;CI NCIAS SOCIAIS APLICADAS;BANNER
12947;AVALIA«√O DO CONFORTO AMBIENTAL NAS SALAS DE AULA DA UNIVERISIDADE FEDERAL DE SERGIPE;FERNANDA  STINGELIN, GLAUBER  BARROS, JOCIMAR  RODRIGUES JUNIOR, LÌVIA  VIEIRA;OUTROS,  UFS;CI NCIAS BIOL”GICAS;BANNER
12940;AN¡LISE COMPARATIVA DAS DAS TEORIAS DE APRENDIZAGEM EM PIAGET E VYGOTSKY;BELMIRO GUILHERME LOPES, LOUIZE GABRIELA SILVA DE SOUZA, RUTH LOPES DE SOUSA, STEPHANIE RAQUEL GUILHERME LOPES;IFRN;CI NCIAS HUMANAS;BANNER
12932;MATERIAIS ALTERNATIVOS UTILIZADOS EM AULAS PR¡TICAS NO ENSINO DE QUÕMICA: UM ESTUDO SOBRE A SUA UTILIZAÁ„O EM ESCOLAS SEM LABORATÛRIOS;MARCIEL NASCIMENTO JUSTINO;IFMA;CI NCIAS EXATAS E DA TERRA;BANNER
12912;DIAGN”STICO AMBIENTAL DO RIO CORRENTE NAS PR”XIMIDADES DO PERÕMETRO URBANO DA CIDADE DE CORRENTE - PI;ANA CARLA RIBEIRO MACIEL, ANA VALÈRIA ALVES RODRIGUES DO NASCIMENTO, BRUNA DE FREITAS IWATA, MILA OHANA MACIEL C…SAR, TANCIO GUTIER AILAN COSTA;IFPI;MULTIDISCIPLINAR;BANNER
12908;A I FEIRA DE INICA«√O CIENTÕFICA DE CATU: SABERES E VIV NCIAS DE ESTUDANTES DA EDUCA«√O PROFISSIONAL;ALEXANDRA SOUZA DE CARVALHO, HENRIQUE CARDOSO SILVA, MARCELO SOUZA OLIVEIRA;IFBA;MULTIDISCIPLINAR;BANNER
12904;LIVRO DID¡TICO DE QUÕMICA: CRIT…RIOS DE SELE«√O A PARTIR DE PAR¬METROS SUGERIDOS POR PROFESSORES E BASEADOS NO GUIA NACIONAL DO LIVRO DID¡TICO;AMANDA DE CARVALHO SANTOS MENEZES;IFBA;CI NCIAS HUMANAS;BANNER
12903;DIAGN”STICO DA PRODU«√O AGRÕCOLA NO ASSENTAMENTO NOVA JERUSAL…M, MUNICÕPIO DE MARAGOGI-AL;IZAILQUE CAROLINO DE OLIVEIRA, JAILSON DO CARMO ALVES, JONATHAS DA SILVA SANTOS, MÙNICA  PÙRTO;OUTROS;CI NCIAS AGR¡RIAS;BANNER
12899;ESTUDO DO USO DO PODER TERMOEL…TRICO PARA ACOMPANHAMENTO DE FRAGILIZA«√O EM UM A«O;BRUNO RIBEIRO ARA˙JO;IFPB;ENGENHARIAS;BANNER
12898;A DID·TICA DA LITERATURA IMAGIN·RIA: UMA AN·LISE A PARTIR DE C.S.LEWIS;NATHAN  D'ALMEIDA ALVES DE OLIVEIRA;IFPB;LINGUÕSTICA, LETRAS E ARTES;BANNER
12897;UTILIZA«√O DO BIODIGESTOR NA REDU«√O DE CARGAS POLUIDORAS EM RIOS DA GRANDE JO√O PESSOA - PB;ANDRÈ  LUIZ DA SILVA, KATYANE LIMA FERREIRA, MAGDALENA DUARTE COSTA, RAFAEL MARQUES DA SILVA LIMA;IFPB;ENGENHARIAS;BANNER
12891;AN¡LISE E AVALIA«√O DOS ASPECTOS SOCIAIS E POLÕTICOS DO PROEJA COMO POLÕTICA P⁄BLICA OFERTADA NO ¬MBITO DO INSTITUTO FEDERAL DO TOCANTINS;JOSE WELLINGTON ABREU PEREIRA;IFTO;CI NCIAS SOCIAIS APLICADAS;BANNER
12890;AVALIA«√O DE FONTES E DOSES DE F”SFORO SOBRE A PRODU«√O DE BIOMASSA DO FEIJ√O MACASSAR;JANDEILSON  ALVES DE ARRUDA, JOSÈ  LUCÌNIO DE OLIVEIRA FREIRE, JOSÈ  WELLINGTON DE MEDEIROS ESTRELA, SEBASTIANA JOELMA  DE AZEVEDO SANTOS, VANDERLÈIA FERNANDA  DOS SANTOS ARA˙JO;IFPB;CI NCIAS AGR¡RIAS;BANNER
12879;REESTRUTURA«√O DE ARRANJO FÕSICO EM IND⁄STRIA DE M”VEIS COM FOCO NA MELHORIA DA QUALIDADE: ESTUDO DE CASO EM MARCENARIA DE NATAL/RN;ALINE DOS SANTOS BARBOSA, LEILTON CAVALCANTI DA SILVA, MICHELLE LUISE SOARES DA SILVA SILVEIRA, RENATA MICHELY DA SILVA NASCIMENTO, RODRIGO AUGUSTO DA SILVA PIMENTEL;IFRN;ENGENHARIAS;BANNER
12873;AVALIA«√O FÕSICO-QUÕMICA DE BEBIDA DE MARACUJ¡ (PASSIFLORA EDULIS F. FLAVICARPA) ELABORADA COM SORO DE LEITE;TATIANE  DE OLIVEIRA XAVIER MACHADO;IF SERT√O-PE;CI NCIAS AGR¡RIAS;BANNER
12870;AN¡LISE QUALIQUANTITATIVA DOS NÕVEIS DE RUÕDOS EMITIDOS NOS TRANSPORTES COLETIVOS DA CIDADE DE CAMPINA GRANDE-PB;ROMILDO  LIMA SOUZA;IFPB;CI NCIAS DA SA⁄DE;ORAL
12868;A ESCOLA E O RELACIONAMENTO HOMOAFETIVO;ELZA  SOUZA;IFPA;CI NCIAS SOCIAIS APLICADAS;BANNER
12866;PR¡TICAS DE LETRAMENTO DIGITAL E O USO DO BLOG EM AULAS DE LÕNGUA INGLESA: UM RELATO DE EXPERI NCIA;JANICE CHIANCA  ARA⁄JO SILVA, JOS… ANDR…  DANTAS PEREIRA, LÕVYA MARIA  GOMES DE MEDEIROS, MIRELLY KAROLINNY  DE MELO MEIRELES, PAULO VÕTOR  DE MEDEIROS BRITO;IFRN;LINGUÕSTICA, LETRAS E ARTES;BANNER
12864;ATIVIDADE DE FAUNA DO SOLO EM SISTEMAS CULTIVADOS NA ZONA DA MATA DE ALAGOAS;GÈSSICA FIGUEREDO MATIAS, JOVENTINO  FERNANDES MOREIRA, KAMILLA PINHEIRO CACHATE;IFAL;CI NCIAS AGR¡RIAS;BANNER
12860;JOGO ARREUG: ESTAT…GIA PARA ELUCIDA«√O DAS PROPRIEDADES PERI”DICAS;MERCIA  DE SOUSA BRITO;IFBA;ENGENHARIAS;BANNER
12856;AN¡LISE DO APEGO AFETIVO, DEPEND NCIA E IDENTIDADE NA COMUNIDADE INDÕGENA CAT⁄ DOS ELEOT…RIOS;JOSILENE  ALVES DE SOUZA, MARIA ANALICE ANTÙNIO DA  SILVA, M·RCIO MARREIRO DAS  CHAGAS, SÈRGIO  MARQUES J˙NIOR;IFRN;CI NCIAS SOCIAIS APLICADAS;BANNER
12843;PROFISSIONALIZA«√O OU QUALIDADE DE ENSINO: A BUSCA DOS ALUNOS PELO IFPB;CAROLINA NIC·CIA OLIVEIRA ROCHA, EDUARDA DE LIMA BARBOSA;IFPB;LINGUÕSTICA, LETRAS E ARTES;ORAL
12842;T…CNICA N√O DESTRUTIVA PARA ACOMPANHAMENTO DE FASE FERRITA;SR. RUFINO MARQUES;IFPB;ENGENHARIAS;BANNER
12839;PESQUISAS ORAIS PARA OBSERVAR IMPACTOS SOCIO-ECONOMICOS EM BUSCA DO RESGATE HIST”RICO DE MURICI A PARTIR DA ENCHENTE DE 2010: CONCIENTIZANDO A POLULA«√O DO MUNICIPIO A CERCA DO CASO;BRUNO CARVALHO DA SILVA;IFAL;CI NCIAS HUMANAS;BANNER
12835;SISTEMA DE MONITORAMENTO DE TEMPERATURA E UMIDADE;ILTON LUIZ BARBACENA, LARYSSA MARIA DE SOUSA DUARTE, ROBERO  EUGÍNIO RODRIGUES;IFPB;ENGENHARIAS;BANNER
12832;RISCO DE ENCHENTE E INUNDA«√O NA REGI√O DO CRISTO REDENTOR E CRUZ DAS ARMAS ¿S MARGENS DO RIO JAGUARIBE EM JO√O PESSOA, PB;ALEXANDRE FONSECA DíANDREA, HÈLDER CAVALCANTE NASCIMENTO, JANAINE SOUZA DOS SANTOS, ROSILENE GOMES NASCIMENTO;IFPB;CI NCIAS SOCIAIS APLICADAS;ORAL
12831;O ENSINO E A PR¡TICA DA BIOLOGIA NA FORMA«√O DOCENTE: UMA DISCUSS√O APOIADA NA VIV NCIA DO EST¡GIO NO MUSEU OCEANOGR¡FICO UNIVALI;ANDERSON LOPES LOPES KLIPEL;IFRO;CI NCIAS HUMANAS;BANNER
12828;ALFACE HIDROP‘NICA CULTIVADA COM SOLU«’ES NUTRITIVAS ALTERNATIVAS AO USO DE FERTILIZANTES MINERAIS A BASE DE NITRATOS;LEANDRO CECÌLIO MATTE, LUANA MARINA PEREIRA GOIS, RITIELLI  GUIMAR„ES FERRARI;IFRO;CI NCIAS AGR¡RIAS;BANNER
12826;ENDEMIAS, UMA QUEST√O SOCIAL: EDUCA«√O PARA PREVEN«√O DA MAL¡RIA, DENGUE, AMEBÕASE E GIARDÕASE NO MUNICÕPIO DO CANT¡-RORAIMA;ELAYNE SILVA MELO;IFRR;CI NCIAS DA SA⁄DE;BANNER
12824;ACESSIBILIDADE È PARA TODOS.;JIOVANE ANDERSON DA SILVA RIBEIRO;IFRO;CI NCIAS SOCIAIS APLICADAS;BANNER
12805;DIAGNOSTICO DAS CONDI«’ES DE USO E OCUPA«√O DAS MARGENS DO RIO ACARA⁄, LOCALIZADO NO MUNICÕPIO DE CRUZ-CE, COM VISTA ¿ ELABORA«√O DE UM PROGRAMA DE EDUCA«√O AMBIENTAL;ADRIANA SARA DA SILVA, ELIZABETH DE ARA˙JO CAVALCANTE, ERL‚NDIA M·RCIA VASCONCELOS, JORGENA DE ALMEIDA JORGE BENEVIDES, VERA L˙CIA SOUSA;IFCE;CI NCIAS BIOL”GICAS;BANNER
12801;LUDICIDADE NO ENSINO DE QUÕMICA PARA SURDOS: UMA APRENDIZAGEM MEDIADA PELA VIS√O;ANTONIO RICARDO ARAUJO GONÁALVES, EVERSON DOS SANTOS TEIXEIRA, HENRIQUE CARDOSO SILVA, SINARA  SILVA NEVES;IFBA;CI NCIAS HUMANAS;BANNER
12788;AN¡LISE DO PERFIL DOS ESTUDANTES DO CURSO DE ENGENHARIA CIVIL DO IFPB ñ CAMPUS CAJAZEIRAS: EXPECTATIVA DE ATUA«√O PROFISSIONAL;CÌCERO MARCIANO DA SILVA SANTOS, FRANCISCO FELIPE PEDROSA BEZERRA, PAULENA ARAUJO ARAUJO SANTANA, ROBSON ARRUDA DOS SANTOS;IFPB;MULTIDISCIPLINAR;BANNER
12786;DISPOSITIVO DE ACIONAMENTO REMOTO PARA SISTEMA DE BOMBEAMENTO DE ¡GUA RESIDENCIAL;ERIC SANTANA FERREIRA, EVADIO PERREIRA FILHO, NELSON LUIZ  DA SILVA OLIVEIRA, THIAGO  DA SILVA RODRIGUES;IFPB,  OUTROS;ENGENHARIAS;BANNER
12782;ROBOIFBA: AMBIENTE DE DIFUS√O DA ROB”TICA EDUCACIONAL;ANDREA C·SSIA PEIXOTO BITENCOURT, HUGO THOM·S D'ALMEIDA E MENDES, JUSTINO  MEDEIROS DE ARA˙JO, LORENNA SANTOS VILAS BOAS;IFBA;MULTIDISCIPLINAR;BANNER
12780;A AQUISI«√O DE LÕNGUAS ADICIONAIS ATRAV…S DE RECURSOS MULTIMODAIS: O AUDIOVISUAL COMO MEDIADOR DA APRENDIZAGEM;ANA CAROLINE PEREIRA SILVA, RONNY DIOGENES MENEZES;IFPB,  IFPE;LINGUÕSTICA, LETRAS E ARTES;BANNER
12778;DIFERENTES POTENCIAIS OSM”TICOS SOBRE  O DESENVOLVIMENTO DO FEIJ√O ARIGOZINHO;FABIO BATISTA LIMA;IFRO;CI NCIAS AGR¡RIAS;BANNER
12775;TECENDO A VALORIZA«√O DO PATRIM‘NIO CULTURAL EM MACEI”;GABRIELA BATISTA SILVA, MARÌLIA ALVIM SILVA;IFAL;MULTIDISCIPLINAR;BANNER
12774;PROGRAMA PR”-EQUIDADE DE G NERO E RA«A: POSSIBILIDADES E DESAFIOS NO INSTITUTO FEDERAL DE ALAGOAS;ARYANE VITORIA PODEROSO DANTAS, BARBARA TEREZA BRAND√O GUERREIRO BARBOSA, DHYEGO SILVA MEDEIROS, LAYANE VICTORIA ANANIAS DA SILVA, MARIANE CRISTINE SILVA BASTOS;IFAL;CI NCIAS HUMANAS;ORAL
12768;DESENVOLVIMENTO DE ROB‘ SEGUIDOR DE LINHA E AN¡LISE DE FUNCIONAMENTO COM DIFERENTES TIPOS DE SENSORES;LAIANE ROCHA MAC·RIO, LUCAS NUNES PEREIRA, LUCAS DE JESUS OLIVEIRA, VICTOR HENRIQUE MOTA MACEDO GUIRRA, WILLIAM GUTERRES OLIVEIRA;IFBA;ENGENHARIAS;BANNER
12763;C·LCULO DO CORTE SUSTENT·VEL DE ·RVORES USANDO UM PROGRAMA EM C++: UMA APLICAÁ„O DA ¡LGEBRA LINEAR;BRUNA DO CARMO PEREIRA, HENRIQUE COSTA FAGUNDES, POLYANE ALVES SANTOS, RAPHAELA NUNES PEREIRA, SEZIBIO KAUAN DE LIMA NUNES;IFBA;ENGENHARIAS;ORAL
12756;COLABORE: SISTEMA WEB DE RECRUTAMENTO DE COLABORADORES;JOABE PINHEIRO DA SILVA, LEANDRO LOPES RAMOS, PABLO FREIRE MATOS;IFBA;CI NCIAS EXATAS E DA TERRA;BANNER
12755;UMA CONTRIBUI«√O AO ESTUDO DE MOTORES EL…TRICOS DE KEPPE E BEDINI;GESSE VIEIRA BARROS, PAULO HENRIQUE FONSECA, SAMUEL RIBEIRO ABREU;IFPB;ENGENHARIAS;BANNER
12753;AGRICULTURA ORG¬NICA COM ENFOQUE NA PRODU«√O SUSTENT¡VEL DE HORTALI«AS: ESTUDO DE CASO POVOADO TRANSARAGUAIA;ERICA RIBEIRO SIMONETTI, GASPAR FERREIRA DA SILVA, PALOMA CASTRO ABREU, …RICA  CHAVES;IFTO;CI NCIAS AGR¡RIAS;BANNER
12747;DESENVOLVIMENTO DE LITHOTHAMNIUM SP PARA O SEMI·RIDO IRRIGADO: GRANULOMETRIA, DOSES E VIA DE APLICAÁ„O NA CULTURA DO TOMATE;B·RBARA DE C·SSIA DA ROCHA GORGONIO;IF SERT√O-PE;CI NCIAS AGR¡RIAS;ORAL
12745;VULNERABILIDADE SOCIOAMBIENTAL: UMA AN¡LISE SOCIOPOLÕTICA E AMBIENTAL DO BAIRRO JO√O CABRAL, JUAZEIRO DO NORTE/CE;BRENDA TAMIRES CONCEIÁ„O E S·, CIEUSA MARIA CALOU E PEREIRA, ONESIA VIEIRA XAVIER;IFCE;ENGENHARIAS;BANNER
12744;DIAGN”STICO DAS CONDI«’ES OCUPACIONAIS DA FEIRA LIVRE DA CIDADE DE CEAR¡-MIRIM/RN;CYBELLE  TEIXEIRA MARQUES;IFRN;CI NCIAS BIOL”GICAS;BANNER
12743;UTILIZA«√O DE RECURSO TECNOL”GICO COMO SUBSÕDIO NO ENSINO DE ANATOMIA VEGETAL PARA O ENSINO M…DIO T…CNICO INTEGRADO DO IFAM;KÈSEDE DA SILVA PEREIRA, LILIAN LOREN DOS ANJOS DO CANTO, MARIA MATILDE DA SILVA CARVALHO, POLIANA ROVERSI GENOVESE MARCOMINI;IFAM;CI NCIAS HUMANAS;BANNER
12741;PLATAFORMA PARA AUTOMA«√O RESIDECIAL;ADEMAR  VIRGOLINO DA SILVA NETTO, LEANDRO  FERREIRA DA SILVA;IFPE;ENGENHARIAS;BANNER
12736;PRODU«AO DE DERIVADO DO IBUPROFENO ATRAV…S DE REA«AO DE ESTERIFICA«AO DE FISHER E SUA A«AO BIOLOGICA FRENTE ¡ PRAGA ACANTHOSCELIDES OBTECTU, O GORGULHO DO FEIJ√O COMUM PHASEOLUS VULGARIS;EDSON DOS SANTOS ALVES, FRANCISCO FELIPE MAIA DA SILVA;IFRN;CI NCIAS EXATAS E DA TERRA;BANNER
12735;ESTIMA«√O DE ESTADOS EM REDES DE DISTRIBUI«√O DE ENERGIA;JAQUELINE  AMANDA CARDOSO BITTENCOURT MORAES;IFMA;ENGENHARIAS;BANNER
12733;T…CNICA DE TRANSPOSI«√O DID¡TICA PARA O ESTUDO DA FISIOLOGIA DOS ANFÕBIOS E R…PTEIS;MARIA HELENA ALVES;IFPB;CI NCIAS BIOL”GICAS;BANNER
12727;AN¡LISE COMPARATIVA DAS OPINI’ES DE INDIVÕDUOS COM DIFERENTES NÕVEIS DE ESCOLARIDADE A RESPEITO DA UTILIZA«√O DE ANIMAIS COMO COBAIAS EM EXPERIMENTOS LABORATORIAIS;AMAURÌCIO LOPES ROCHA BRAND„O, FRANCISCA WILIANA DE LIMA AMORIM;IFCE;MULTIDISCIPLINAR;BANNER
12721;CARACTERIZA«√O FÕSICO-QUÕMICA DE SUCO MISTO DE ACEROLA (MALPIGHIA EMARGINATA L.) COM VINAGREIRA (HIBISCUS SABDARIFFA L.);CECÌLIA  PEREIRA, DALVA  PEREIRA, ISABELA  CORDEIRO, MANOEL  MARQUES, RENATA  FREITAS;IFMA,  IFPI;CI NCIAS AGR¡RIAS;BANNER
12718;RIOS URBANOS: ELO AMBIENTAL ENTRE SALVADOR E A BAÕA DE TODOS OS SANTOS ñ BRASIL;CASSIO DE JESUS VIANA, JULIANA PEREIRA PETRONILIO DOS SANTOS, PLINIO MARTINS FALC„O;IFBA;CI NCIAS HUMANAS;BANNER
12714;LEVANTAMENTO DO MODELO DA TENS√O DE  FORNECIMENTO E DO FATOR DE POT NCIA UTILIZANDO  ESTIMADORES RECURSIVOS;EDERSON  SANTOS;IFPA;ENGENHARIAS;ORAL
12710;DESEMPENHO AGRON‘MICO DE GEN”TIPOS DE FEIJ√O-CAUPI EM VIT”RIA DA CONQUISTA, BAHIA;EVERARDES  P˙BLIO J˙NIOR, OTONIEL MAGALH„ES MORAIS, SAMILE NAIANE GONÁALVES DE JESUS, UBIRATAN OLIVEIRA SOUZA, UESLEI BRUNO CARDOSO MEDEIROS;OUTROS;CI NCIAS AGR¡RIAS;BANNER
12705;EFIC¡CIA DA IVERMECTINA NO CONTROLE DE PARASITAS GASTROINTESTINAIS EM OVINOS NO SEMI¡RIDO PARAIBANO;AMAÌRA CASIMIRO DO NASCIMENTO, AMÈLIA LIZZIANE LEITE DUARTE, JOSÈ GABRIEL GONÁALVES LINS, SERGINARA DAVID RODRIGUES, THALLES LUAN ABRANTES FERREIRA;IFPB;CI NCIAS AGR¡RIAS;BANNER
12700;CONTRIBUI«’ES E LIMITA«’ES DA INICIA«√O CIENTÕFICA PARA A FORMA«√O PROFISSIONAL E CONSTRU«√O DO CONHECIMENTO DE QUÕMICA DE ALUNOS DO ENSINO M…DIO INTEGRADO ñ ESTUDO DE CASO DO IFCE - CAMPUS UMIRIM;ANA PAULA AQUINO BENIGNO, ANTÙNIA HARESSA  OLIVEIRA DOS SANTOS, JOSÈ DAVI FERREIRA DA SILVA NOGUEIRA, PAULO CESAR COSTA DE OLIVEIRA, REBECA DE CASTRO SALES;IFCE,  OUTROS;CI NCIAS EXATAS E DA TERRA;BANNER
12697;AN¡LISE DO GERENCIAMENTO ESTRAT…GICO SOCIOAMBIENTAL DO RESTAURANTE UNIVERSIT¡RIO DA UNIVERSIDADE FEDERAL DE SERGIPE;FERNANDA  STINGELIN, GLAUBER  BARROS, JOCIMAR  RODRIGUES JUNIOR, LÌVIA  VIEIRA;OUTROS,  UFS;ENGENHARIAS;BANNER
12690;DESENVOLVIMENTO DE PROTÛTIPO DE ILUMINAÁ„O POR LED RGB UTILIZANDO MODULAÁ„O PWM;FRANCISCO JOSÈ ALVES AQUINO, F·BIO BARROSO BRITO, POLYCARPO SOUZA NETO, WELLINGTON DANTAS ALMEIDA;IFCE;ENGENHARIAS;BANNER
12687;PRODU«√O DE BIOMASSA DE BAMBU IRRIGADO E EFICI NCIA DO USO DA ¡GUA EM TR S ESPA«AMENTOS DE PLANTIO;DANIEL  SANTANA COLARES;IFTO;CI NCIAS AGR¡RIAS;BANNER
12686;A PERSPECTIVA DOS ÕNDIOS DA ALDEIA KANIND… DE ARATUBA SOBRE DOCES TRADICIONAIS INDÕGENAS;ANNA …RIKA FERREIRA LIMA, ANTONIO BEZERRA LEITE JUNIOR, ANTONIO BRENO OLIVEIRA SILVA;IFCE;MULTIDISCIPLINAR;BANNER
12684;METODOLOGIAS PARA O ENSINO DE CI NCIAS: DESAFIOS DE DOCENTES EM ESCOLAS P⁄BLICAS DE UM MUNICÕPIO DE ALAGOAS ñ BRASIL;MARIA LUSIA DE MORAIS BELO BEZERRA;IFAL;CI NCIAS HUMANAS;BANNER
12683;A MANIPULA«√O DE MAT…RIAS-PRIMAS NATURAIS: AS PROPRIEDADES DA QUÕMICA TRANSG NICA E O CONSEQUENTE DESFECHO MERCADOL”GICO;JEFERSON ARA˙JO ALMEIDA, JHONATAN SANTOS PINTO, MARCIA SEP˙LVIDA DO VALE;IFTO;CI NCIAS EXATAS E DA TERRA;BANNER
12682;CRIA«√O DE UM BANCO DE DADOS PARA APOIAR O MAPEAMENTO GEOT…CNICO DA REGI√O DO CARIRI ATRAV…S DE ENSAIOS PARA APLICA«√O EM DIMENSIONAMENTO DE PAVIMENTOS;JULIETTE  MACENA DE SOUZA;IFCE;ENGENHARIAS;ORAL
12678;HANSENÕASE EM A«AIL¬NDIA: INCIDÍNCIA E CARACTERÌSTICAS DOS CASOS NOTIFICADOS NO PERÌODO DE 2010 A 2015;ELIANE CARDOSO DE ARA˙JO, HELEN  ROSENO, JHON VITOR FERRREIRA DE LIMA;IFMA;CI NCIAS DA SA⁄DE;BANNER
12676;A IMPORT¬NCIA E INFLU NCIA DA IMPLANTA«√O DE UM ENSINO DE QUALIDADE: UMA AN¡LISE DAS TAXAS DE INGRESSANTES NO CURSO DE ENGENHARIA AMBIENTAL;GRASIELE  DE OLIVEIRA CRUZ, KAIQUE  BRITO MOREIRA, LARA DE OLIVEIRA CARVALHO, MANOEL MESSIAS COUTINHO MEIRA, POLYANE  ALVES SANTOS;IFBA;CI NCIAS HUMANAS;BANNER
12671;DETERMINA«√O DE AS, BA, MO E NI EMPREGANDO ICP OES EM AMOSTRAS DE LEGUMINOSAS PRODUZIDAS NO ESTADO DA BAHIA, BRASIL;DANIELE VALVERDE JESUS, LUIZA SANTANA SOUZA, MARI‚NGELA VIEIRA SILVA, SANDRA REGINA COSTA, WAGNA PILER SANTOS;IFBA,  UNEB;CI NCIAS EXATAS E DA TERRA;BANNER
12670;DETERMINA«√O DE FENOIS TOTAIS E ATIVIDADE ANTIOXIDANTE DA PR”POLIS VERMELHA DE ALAGOAS DURANTE ESTUDO DE SAZONALIDADE;ROD‘LFO ELLESON DOS SANTOS ARRUDA;UFAL;CI NCIAS DA SA⁄DE;BANNER
12668;PROJETO DE EXTENS√O MINICURSO HORTA NA ESCOLA;EMMANUELE RIBEIRO DE MENDONÁA, NAYARA STEFANYE LOPES DE ARA˙JO, PAULA DAIANY DE FREITAS SILVA;IFPE,  OUTROS;MULTIDISCIPLINAR;BANNER
12664;AVALIA«√O DA GEST√O DE MEIOS E MATERIAIS DE UM HOSPITAL UNIVERSIT¡RIO FEDERAL DO NORDESTE: A UTILIZA«√O DA LOGÕSTICA COMO FERRAMENTA PROPULSORA NA EFICI NCIA DAS ATRIBUI«’ES DO ALMOXARIFADO HOSPITALAR;NAYARA  SANTANA;IFRN;ENGENHARIAS;BANNER
12662;UMA VIS√O GERAL SOBRE BUSCAS SEM¬NTICAS E SEUS MECANISMOS;JOCÈLIA DA HORA OLIVEIRA BARBOSA, NÈLIO FRAZ„O CHAVES;IFPB,  OUTROS;CI NCIAS EXATAS E DA TERRA;BANNER
12659;FABRICA«√O DE UMA CAIXA DE REDU«√O PARA ADAPTA«√O DE UMA BANCADA EXPERIMENTAL DESTINADA A AN¡LISE PREDITIVA DE FALHAS;LEONARDO JOSÈ CAVALCANTE VASCONCELOS;IFPE;ENGENHARIAS;BANNER
12653;CONSUMO CONSCIENTE EM DEBATE;ANDRE LUIZ FERREIRA, ANDRE LUIZ SANTOS, GABRIELE  FERREIRA, JANAINA GOMES SOARES;IFAL;MULTIDISCIPLINAR;BANNER
12651;COMPOSI«√O BROMATOL”GICA DE GEN”TIPOS DE GIRASSOL;ARIOMAR RODRIGUES DOS SANTOS, AURELIANO JOSÈ VIEIRA PIRES, NAYARA  VIANA, PHELIPE SILVA RODRIGUES;IF BAIANO,  IFBA,  UESB,  UNIVASF;CI NCIAS AGR¡RIAS;BANNER
12636;ESTUDO COMPARATIVO DOS PROCEDIMENTOS DE DOSAGEM IPT-USP E ACI;ADRIANO  SOUSA SANTOS, DUÌLIO  HELFENSTENS PENQUES DA SILVA, LUCAS  DAMACENO PEREIRA E SILVA, MOACYR  SALLES NETO, RAYCA  SABRINA CAETANO;IFTO;ENGENHARIAS;BANNER
12631;DESENVOLVIMENTO DE SISTEMAS DE CONTROLE DE VACINA«√O PARA BOVINOS;JOHN DAVID DE MENEZES NUNES;IFRO;MULTIDISCIPLINAR;BANNER
12619;QUEM EU SOU? ONDE ESTOU? O OLHAR DOCENTE SOBRE A EDUCA«√O PROFISSIONAL E O CURRICULO INTEGRADO NO IFMA.;CUNHA AGUIAR CUNHA;IFMA;CI NCIAS HUMANAS;ORAL
12608;INFLU NCIA DE SULFATO DE AM‘NIO NA FERMENTA«√O DE RESÕDUO AGROINDUSTRIAL PARA PRODU«√O DE ¡CIDO CÕTRICO;ALYNE  VASCONCELOS CAVALCANTE, CARLOS RONALD PESSOA WANDERLEY, GLÛRIA  MARINHO, KELLY  RODRIGUES, NATH·LIA  ARA˙JO MAGALH„ES;IFCE;CI NCIAS BIOL”GICAS;BANNER
12607;POLÕTICAS DE SEGURAN«A DA INFORMA«√O: UMA INVESTIGA«√O SOBRE O GERENCIAMENTO DA SEGURAN«A DA INFORMA«√O NA PERSPECTIVA DE EMPRESAS DE M…DIO PORTE DE PARAÕSO DO TOCANTINS;BRUNNA CAROLINE DO CARMO MOUR„O, GISLAINE PEREIRA SALES, HALLEM STEFANI TAVARES RODRIGUES ROCHA, THATIANE DE OLIVEIRA ROSA;IFTO;CI NCIAS EXATAS E DA TERRA;BANNER
12603;A EXTENS√O COMO ATIVIDADE FORMATIVA NO ENSINO T…CNICO;BRUNO RODRIGUES DA MATA, ELIELMA SANTANA FERNANDES;IFBAIANO  ;MULTIDISCIPLINAR;ORAL
12598;PERCEP«√O DOS DISCENTES SOBRE O DESPERDÕCIO DE ¡GUA EM ESCOLA MUNICIPAL DE 1∫ GRAU EM FORMOSA DO RIO PRETO - BA;BRUNA DE FREITAS IWATA, DAIANE FERREIRA DE ALMEIDA, EDINEUZA AZEVEDO COSTA, LARISSA DO NASCIMENTO SERPA, T‚NCIO GUTIER AILAN COSTA;IFPI;MULTIDISCIPLINAR;BANNER
12592;UMA AN¡LISE DO USO DA GEST√O FINANCEIRA COMO INSTRUMENTO DE EFICI NCIA NA ADMINISTRA«√O DAS EMPRESAS DA CIDADE CANIND…;KARINE COELHO SANTOS, MARIA CAROLINE SALES DA SILVA;IFCE;CI NCIAS SOCIAIS APLICADAS;BANNER
12591;CONHECIMENTOS PR…VIOS: UMA ESTRAT…GIA DID¡TICA PARA O ENSINO DE QUÕMICA;ANGELIKA  DE ARA˙JO JALES;IFRN;CI NCIAS EXATAS E DA TERRA;BANNER
12589;PESQUISA DE MERCADO: RESTRI«’ES ALIMENTARES;LAYS EMANUELLE DE FRANÁA GONÁALVES;IFCE;CI NCIAS AGR¡RIAS;BANNER
12586;ULTRASSOM TERAP UTICO: REGENERA«√O E CICATRIZA«√O DE LES’ES;IAGO BRUNO  FRANÁA;IFRN;CI NCIAS DA SA⁄DE;BANNER
12583;INFORMART BETA: UMA PROPOSTA METODOL”GICA INTERDISCIPLINAR;FERNANDO  SOARES DE FRANÁA, KARINA  DE OLIVEIRA DE LIMA, KLEBER KROLL  DE AZEVEDO SILVA, LOUIZE GABRIELA SILVA DE SOUZA, MIKE CHRISTIAN DE SOUSA ARAUJO;IFPI,  IFRN;MULTIDISCIPLINAR;BANNER
12580;LIGHT PAINTING: A ARTE DE PINTAR COM A LUZ;JO„O PEDRO RIBEIRO LIMA;IFTO;LINGUÕSTICA, LETRAS E ARTES;ORAL
12572;HORTA ORG‚NICA COMO FERRAMENTA PARA O DESENVOLVIMENTO SUSTENT·VEL;ANDERSON EDUARDO SANTOS, ANDRÈ MONTEIRO GOMES, JEAN  HENRIQUE MENEZES, MÙNICA LANZA PADR„O;IFS,  UFS;MULTIDISCIPLINAR;BANNER
12570;OS DESAFIOS DA RETEN«√O ESCOLAR NA EDUCA«√O DO CAMPO;MARIA  LIMA;IFPA;CI NCIAS SOCIAIS APLICADAS;BANNER
12568;EDUCA«√O EM SA⁄DE COM JOVENS ESCOLARES ABORDANDO GRAVIDEZ NA ADOLESC NCIA: RELATO DE EXPERI NCIA;AMANDA HAISSA BARROS HENRIQUES, EDJA CLÈBYA DOS SANTOS MELO, JULIANA  DE CASTRO NUNES PEREIRA, LUCIANA  UCHÙA BARBOSA, PATRÌCIA MARIA DE OLIVEIRA ANDRADE ARA˙JO;IFPE;CI NCIAS DA SA⁄DE;BANNER
12566;DESENVOLVENDO A CIDADANIA: UM TRABALHO REALIZADO NO CURSO DE ADMINISTRA«√O;FRANSERGIO BUCAR AFONSO PEREIRA, PAULA JUCA DE SOUSA SANTOS, SIMONE MATOS DOS SANTOS TEIXEIRA;IFTO;CI NCIAS SOCIAIS APLICADAS;BANNER
12563;VIABILIDADE ECON‘MICA DA ACEROLA (MALPIGHIA SP) PRODUZIDA EM QUINTAIS URBANOS EM PICUÕ - PARAÕBA;AIRTON  SILVA BRAZ, CYNTHIA  DE LIMA CAMPOS, SEBASTIANA JOELMA  AZEVEDO SANTOS;IFPB;CI NCIAS AGR¡RIAS;BANNER
12558;AVALIAÁ„O FÌSICO-QUÌMICA E BACTERIOLÛGICA DA ·GUA DAS CISTERNAS DO MUNICÌPIO DE ITATUBA-PB;RAYSSA MOREIRA MOREIRA;IFPB;CI NCIAS BIOL”GICAS;BANNER
12553;CONSTRU«’ES DE BRINQUEDOS COM MATERIAIS DE BAIXO CUSTO PARA O USO NO ENSINO DE FÕSICA EM ESCOLAS DO MUNICÕPIO NA CIDADE DE S√O JO√O DOS PATOS-MA.;ALEXSANDRA SILVA NASCIMENTO, ANA MARIA SILVA, EDUARDO HENRIQUE ALBUQUERQUE DO NASCIMENTO;IFMA;MULTIDISCIPLINAR;BANNER
12546;PERFIL DO CONSUMO DE PESCADO POR ESTUDANTES DO INSTITUTO FEDERAL DE EDUCA«√O, CI NCIA E TECNOLOGIA DO AMAZONAS DO MUNICÕPIO DE COARI, AM;ELIANDO PICANÁO TENAÁOL, KALYSON DE SOUZA MARTINS, MARCIO QUARA DE CARVALHO SANTOS;IFAM;CI NCIAS AGR¡RIAS;BANNER
12544;AVALIA«√O IN SILICO DE INIBIDORES DO FOTOSSITEMA II;VITOR PRATES LORENZO;IFS;CI NCIAS AGR¡RIAS;BANNER
12542;CARACTERIZA«√O QUÕMICA DE COMPOSTOS ORG¬NICOS E DE BIOSS”LIDO UTILIZADOS NA COMPOSI«√O DE SUBSTRATOS DE MUDAS DE ESP…CIES FLORESTAIS DESTINADAS A REVEGETA«√O DE ¡REAS DEGRADADAS;FABIOLA  GOMES DE CARVALHO, KAREM TALLITA VARELA DE SIQUEIRA;IFRN;MULTIDISCIPLINAR;ORAL
