9905;COME TOGETHER: SISTEMA PARA AUXÕLIO ¿ MOBILIDADE URBANA E GERENCIAMENTO DE EVENTOS;ANDERSON LUIZ SOUZA MOREIRA, FELIPE ROSACRUZ CONSTANTINO, JO„O EUDES LEITE LEMOS;IFPE;CI NCIAS EXATAS E DA TERRA;BANNER
9897;MARKETING SOCIAL E NEUROCI NCIA: NOVOS M…TODOS PARA AFERI«√O E APRIMORAMENTO DE CAMPANHAS DE SA⁄DE P⁄BLICA NO CONTEXTO AMAZ‘NICO;DIOGO  RÛGORA KAWANO, LUAN MATHEUS  GONÁALVES RODRIGUES;IFAP;CI NCIAS SOCIAIS APLICADAS;BANNER
9893;RWST - REUSE OF WATER FOR SUSTAINABLE TECHNOLOGY;ALMERINDO NASCIMENTO REHEM NETO, BRUNNA SUELLEN MARTINS BARRETO, FERNANDO HENRIQUE VIEIRA TRINDADE, GYOVANI YURI SOUZA SANTOS, IGOR VICTOR SOUZA BATISTA;IFS;CI NCIAS EXATAS E DA TERRA;BANNER
9892;APLICATIVO WEB PARA PESQUISAS DESENVOLVIDO COM A FERRAMENTA METEOR;ADRIANA APARECIDA RIGOLON GUIMAR„ES, JACKSON HENRIQUE DA SILVA BEZERRA, JÈSSICA  GIORI, LEONARDO  BRAZ, MARCO ANTÙNIO SANTOS SOUZA;IFRO;CI NCIAS EXATAS E DA TERRA;BANNER
9890;AVALIA«√O PRODUTIVA DO  FEIJ√O-CAUPI (VIGNA UNGUICULATA)  CULTIVADO SOB DIFERENTES L¬MINAS DE IRRIGA«√O;CRUZ  ALMEIDA;IFMA;CI NCIAS AGR¡RIAS;BANNER
9889;QUILABIRINTO DA ISOMERIA: EM BUSCA DO ENTENDIMENTO SOBRE F¡RMACOS QUIRAIS;CAMILA SILVA SANTOS, F·BIO RODRIGUES SANTOS;IFBA,  UNEB;CI NCIAS HUMANAS;BANNER
9888;A REDE DE ATEN«√O ¿ SA⁄DE NO ¬MBITO REGIONAL E SEUS REFLEXOS NA MORTALIDADE INFANTIL EM PESQUEIRA-PE;MAÌLA BEZERRA SOUZA, ROBERVAM DE MOURA PEDROZA, STEPHANE MARCELE ALMEIDA BRAGA;IFPE;CI NCIAS DA SA⁄DE;BANNER
9886;MINIPLANO - A PRIMEIRA EXPERI NCIA EMPREENDEDORA;CAMILA AQUINO BEZERRA, JARBAS WILLAMY COSTA, MARIA DO SOCORRO ASSIS BRAUN;IFCE;CI NCIAS SOCIAIS APLICADAS;BANNER
9885;GESP⁄BLICA: ESTUDO DE APLICABILIDADE PARA A ADMINISTRA«√O P⁄BLICA NO ESTADO DE ROND‘NIA;PATRÌCIA PEREIRA DA SILVA, V·LDESON AMARO LIMA;IFRO;CI NCIAS SOCIAIS APLICADAS;BANNER
9880;ESTADO NUTRICIONAL DE PR…-ESCOLARES DE UMA INSTITUI«√O DE ENSINO PRIVADO DE LIMOEIRO DO NORTE-CE;CAROLINA  PEREIRA DOS REIS, Danilo de Oliveira Sousa, Alinne Suyanne da Costa, Andreza Kathiuze Maia,  J‚nia Maria Augusta da Silva;IFCE;CI NCIAS DA SA⁄DE;BANNER
9879;O ENSINO B¡SICO, T…CNICO E TECNOL”GICO NA CIDADE DE FLORIANO: PERFIL PROFISSIONAL E IDENTIDADE;FILANGE SOARES VIEIRA NETO, JOSÈ RIBAMAR LOPES BATISTA J˙NIOR, JUSCYNAIRA DE SOUSA VIEIRA, RICARDO DE CASTRO RIBEIRO SANTOS, …TNNY COÍLHO DE S· PEREIRA;OUTROS,  UFPI;CI NCIAS HUMANAS;BANNER
9876;A NECESSIDADE DO USO DO  EPI- EQUIPAMENTOS DE PROTE«√O INDIVIDUAL NAS COMUNIDADES RURAIS DA REGI√O DE SOUSA-PB;MAYSLANE  DE SOUSA GOMES;IFPB;MULTIDISCIPLINAR;BANNER
9865;AVALIA«√O DA VIABILIDADE DE MICRORGANISMOS PROBI”TICOS EM LEITES FERMENTADOS COMERCIALIZADOS NA CIDADE DE CURRAIS NOVOS/RN;DEBORA ALANNA ARA⁄JO DE AQUINO, INGRID MARIA OLIVEIRA LEITE, JONAS LUIZ ALMADA DA SILVA;IFRN;CI NCIAS AGR¡RIAS;BANNER
9864;"¡GUA SUPERFICIAL; PAR‚METROS FÌSICO-QUÌMICOS, CONTAMINAÁ„O";ANA DA SILVA CARLA, LUCIANE DA CUNHA CODOGNOTO, RODOLFO GRAFFUNDER GRAFFUNDER, TAUANA PEREIRA DANIELE, THASSIANE CONDE TELLES;IFRO,  UNOPAR;CI NCIAS EXATAS E DA TERRA;BANNER
9860;DO ìBIOSî A ìZOÀî: UM DUPLO DESAFIO NO S…CULO XXI ñ IMIGRA«√O E REFUGIADOS;ROSELANDIA COELHO ROCHA;IFBA;CI NCIAS HUMANAS;BANNER
9851;AN¡LISE QUANTITATIVA E QUALITATIVA DE HORTALI«AS COMERCIALIZADAS EM FEIRAS LIVRES DA CIDADE DE JUAZEIRO DO NORTE ñ CE;ERLAN OLIVEIRA OLIVEIRA, FRANCISCA KAMILA AMANCIO FRUTUOSO, FRANCISCO CLARK NOGUEIRA BARROS, MARIA LUCILENE QUEIROZ SILVA, MONALISA NEVES ARRAIS;IFCE;ENGENHARIAS;BANNER
9848;AVALIA«√O DE CONTAMINA«√O FECAL EM HORTALI«AS COMERCIALIZADAS EM MERCADOS P⁄BLICOS DA CIDADE DE JUAZEIRO DO NORTE ñ CE;DANIEL APOLINARIO MOREIRA, FRANCISCA KAMILA AMANCIO FRUTUOSO, FRANCISCO CLARK NOGUEIRA BARROS, MONALISA NEVES ARRAIS, YANNICE TATIANE DA COSTA SANTOS;IFCE;ENGENHARIAS;BANNER
9847;A ATUA«√O DOS 3 RíS DA SUSTENTABILIDADE - REDUZIR, REUTILIZAR E RECICLAR ñ EMPREGANDO A INFORM¡TICA COMO INSTRUMENTO DE EDUCA«√O AMBIENTAL EM UMA ESCOLA P⁄BLICA DE ALAGOAS;ALDO  DA SILVA OLIVEIRA, MARIA  JOSÈ DOS SANTOS BARBOSA OLIVEIRA, MARIANNA  PEREIRA BARROS, TAMIRES  CORREIA DOS SANTOS;IFAL,  OUTROS;CI NCIAS BIOL”GICAS;BANNER
9846;DESVELANDO A IMPORT¬NCIA DO PAAE, SOBRE A A«√O AFIRMATIVA DE COTAS SOCIOECON‘MICAS E …TNICO-RACIAIS DO IFBA / CAMPUS SALVADOR;ANTONIA DO SOCORRO  FREITAS CHAVES;IFBA;CI NCIAS HUMANAS;BANNER
9843;AVALI«√O DA PARTIDA DE REATOR ANAMMOX;JAIDIS  MOURA;IFCE;ENGENHARIAS;BANNER
9840;BULLYING: A VIOLÍNCIA INSTITUCIONALIZADA NO ESPAÁO DE APRENDIZADO;MARCOS ANTONIO ALVES DA SILVA;IFMA;CI NCIAS HUMANAS;BANNER
9838;DESTINA«√O DOS RESÕDUOS DE CONSTRU«√O E DEMOLI«√O (RCD) DA CIDADE DE QUIXAD¡-CE;FRANCISCA HULDANARA FONSECA;IFCE;ENGENHARIAS;BANNER
9837;OPERADOR DE TORNO MEC‚NICO;ALANA OLIVEIRA OLIVEIRA;IFS;ENGENHARIAS;BANNER
9832;QUANTIFICA«√O E CARACTERIZA«√O POR INFRAVERMELHO DE SUBST¬NCIAS H⁄MICAS AQU¡TICAS PRESENTE NA ¡GUA DO A«UDE GAVI√O;HUGO LEONARDO BUARQUE, REBECA SALDANHA CASTRO, SANDRA IARA NASCIMENTO;IFCE;ENGENHARIAS;BANNER
9829;N„O ESTOU EM CRISE, ESTOU EM CURSO: DESENVOLVIMENTO DO PENSAMENTO MATEM·TICO PARA UMA VIDA MELHOR;ENEIDA  SANTANA BAUMANN;IFBA;CI NCIAS HUMANAS;BANNER
9828;AN¡LISE FÕSICA, FÕSICO-QUÕMICA, QUÕMICA E ANTIOXIDANTE DO GENGIBRE (ZINGIBER OFFICINALE ROSCOE) E CRISTAIS DE GENGIBRE;FERNANDA DA SILVA COSTA SOARES, FHANUEL SILVA ANDRADE, JURANDY DO NASCIMENTO SILVA, ROS·LIA MARIA TÙRRES DE LIMA, SELMA  BALDEZ;IFPI;CI NCIAS AGR¡RIAS;BANNER
9827;ESTUDO SOBRE MOTIVA«√O NUMA INSTITUI«√O EDUCACIONAL DE NOVA CRUZ/RN: APLICA«√O DA TEORIA DOS DOIS FATORES;JOSÈ IRINEU J˙NIOR, LAIANNI VITÛRIA SILVA, THIAGO JOSÈ LOUREIRO;IFRN;CI NCIAS SOCIAIS APLICADAS;ORAL
9823;AVALIA«√O SENSORIAL DE GELEIA COMUM E LIGHT DE BURITI (MAURITIA FLEXUOSA L.) COM MESOCARPO DE MARACUJ¡ AMARELO (PASSIFLORA EDULIS FLAVICARPA D.);CECÕLIA  MUNIZ, CARLIANE  MUNIZ, FRANCISCA  SOARES, FERNANDA  LAYSE, PATRICIA  XIMENES;IFMA;CI NCIAS AGR¡RIAS;BANNER
9820;MUSICA E COMPUTAÁ„O: POSSIBILIDADE DE USO E MELHORIAS DO SOFTWARE LIVRE SOLFEGE NO ENSINO DA PERCEPÁ„O MUSICAL EM CURSOS DE LICENCIATURA.;JOSÈ  HENRIQUE DA SILVA, JO„O  ALMEIDA E SILVA, LUCAS  EMANUEL SOUZA SILVA, MARCÌLIO  BEZERRA DUARTE, PAULO  VICTOR ESPINDOLA FERNANDES;IFPE;MULTIDISCIPLINAR;BANNER
9819;PRODU«√O DE ARTESANATO COM RAIZES MORTAS COMO ALTERNATIVA NO ENSINO DE BOT¬NICA;MARIA FRANCISCA DA SILVA MELO, ROSENILDA DO NASCIMENTO CARDOSO;IFTO;CI NCIAS BIOL”GICAS;BANNER
9818;A EDUCA«√O MATEM¡TICA PARA FORMA«√O DOCENTE: ESTRAT…GIAS DE MEDIA«√O MOBILE LEARNING ATRAV…S DA PLATAFORMA AULA PRONTA;ENEIDA  SANTANA BAUMANN;IFBA;CI NCIAS HUMANAS;BANNER
9814;O OLHAR LITER¡RIO ¿ CIDADE DE TERESINA EM H. DOBAL E PAULO MACHADO;PABLO RODRIGO DA SILVA  MARTINS;IFPI;LINGUÕSTICA, LETRAS E ARTES;ORAL
9812;REMO«√O DE PESTICIDA ATRAZINA ATRAV…S DA ADSOR«√O UTILIZANDO SEMENTE DE NONI (MORINDA CITRIFOLIA L.);BRUNO CÈSAR  BARROSO SALGADO, CAIO VICTOR  PEREIRA PASCOAL, CAROLINE DE GOES SAMPAIO, EMÌLIA MARIA  ALVES SANTOS, FRANCISCO BEZERRA DE MATOS NETO;IFCE;ENGENHARIAS;BANNER
9809;CONHECIMENTOS DOS ADOLESCENTES SOBRE HIV/AIDS/IST NO INTERIOR DE PERNAMBUCO;ANA KARINE LARANJEIRA DE S·, HALERRANDRO  GOMES BORBA, LUCIELLY KEILLA FALC„O NERI DE OLIVEIRA, SAMARA MARIA DE JESUS VERAS, SILVANA  CAVALCANTI DOS SANTOS;IFPE;CI NCIAS DA SA⁄DE;BANNER
9808;O L⁄DICO COMO INSTRUMENTO DE APRENDIZAGEM CONTEXTUALIZANDO O CONTE⁄DO DE SEPARA«√O DE MISTURAS;BRUNO  ENEDINO DE OLIVEIRA SILVA;IFPB;CI NCIAS HUMANAS;BANNER
9807;TURISMO E HOSPITALIDADE VIRTUAL: DESENVOLVIMENTO DE PORTAL DE DIVULGAÁ„O TURÌSTICA PARA O DESTINO S„O LUÌS (MA);ALIDIA CLICIA SILVA SODRE, LUCAS DE JESUS LINDOSO TEIXEIRA, LUCAS HENRIQUE PEREIRA PONTES, TEREZINHA DE JESUS CAMPOS DE LIMA;IFMA;CI NCIAS SOCIAIS APLICADAS;BANNER
9806;A NEUTRALIDADE CIENTÕFICA DE ALBERT EINSTEIN: O EFEITO FOTOEL…TRICO;ELISEU  SOUZA;IFBA;CI NCIAS HUMANAS;BANNER
9803;AN¡LISE DE ESTABILIDADE EM NANOEMULS√O O/A ¿ BASE DE  ”LEO DE COPAIFFERASP. E NANOPARTÕCULAS DE FERRITA DE  ZINCO;ALICE SPERANDIO PORTO, ANDREZA PEREIRA MENDONÁA, JUDES GONÁALVES DOS SANTOS, MATEUS DUARTE VIEIRA, VICTORIA CASTELLAN SANTOS;IFRO,  UNIR;CI NCIAS BIOL”GICAS;BANNER
9800;TECNOLOGIA EDUCACIONAL QUEBRA CABE«A ORO B¡: RESPONDA SE FOR CAPAZ;ANY RAYRA VIEIRA COSTA, HELENA DO SOCORRO CAMPOS DA ROCHA, JESSICA SILVA DO NASCIMENTO, JOELMA MENDES SOARES BARBOSA;IFPA;LINGUÕSTICA, LETRAS E ARTES;BANNER
9799;DIAGN”STICO DA GEST√O E GERENCIAMENTO DOS RESÕDUOS DA CONSTRU«√O CIVIL NA CIDADE DE CAJAZEIRAS-PB;AMANDA JÈSSICA RODRIGUES SILVA, ANTÙNIO WAGNER LIMA, THACYLA MILENA PL·CIDO NOGUEIRA;IFPB;ENGENHARIAS;BANNER
9787;BARREIRA ELETR‘NICA PARA COMPETI«’ES DE ROB”TICA;ABIMAEL ROCHA DE ALBUQUERQUE, B·RBARA GRAZIELLE FIRMINO DE ARAUJO, ILTON LUIZ BARBACENA, J˙LIO CÈZAR COÍLHO BARBOSA TORQUATO, VITÛRIA RÈGIA SANTANA SANTOS;IFPB;ENGENHARIAS;BANNER
9780;TELEFONE CELULAR COMO ESTRAT…GIA NO ENSINO DE CI NCIAS EM TURMAS DE S…TIMO E OITAVO NA ESCOLA MUL. ANNE FRANK.;HUMBERTO  JOSÈ GAMA DA SILVA;IFTO;MULTIDISCIPLINAR;BANNER
9777;PRODU«√O DE FARINHA LIOFILIZADA DE FÕGADO BOVINO;CLARA ANDREZZA ANDREZZA CRISÛSTOMO BEZERRA COSTA, INGRID SOFIA VIEIRA MELO, JO„O GOMES DA COSTA, JO„O VICTOR LAURINDO DOS SANTOS, JACQUELINE  VIEIRA DA SILVA;EMBRAPA,  IFAL,  OUTROS;CI NCIAS AGR¡RIAS;ORAL
9774;AVALIA«√O MICROBIOL”GICA DE QUEIJO DE COALHO PRODUZIDO ARTESANALMENTE E COMERCIALIZADO EM CURRAIS NOVOS/RN;AYSLANNY THUANY ARA⁄JO DE OLIVEIRA, DANIELE COSTA DE LIMA, JONAS LUIZ ALMADA SILVA;IFRN,  OUTROS;CI NCIAS AGR¡RIAS;BANNER
9770;A CONSTRU«√O DO SABER MATEM¡TICO NA LITERATURA DE JORGE LUIS BORGES: AN¡LISE COMBINAT”RIA;EDITE LUZIA DE ALMEIDA VASCONCELOS, QUEICE JONES BRAGA SANTOS;IFBA;MULTIDISCIPLINAR;BANNER
9765;DESENVOLVIMENTO DO SOFTWARE PARA AUXILIAR NO DIMENSIONAMENTO DA LUMINOT…CNICA DE AMBIENTES RESIDENCIAIS E INDUSTRIAIS;DAMI„O FAUSTINO DE ARA˙JO, JEFTÈ BARBOSA DE BRITO, JORGE HENRIQUE RIBEIRO DA SILVA, JOSÈ GALDINO DA SILVA, VALDEMIRO GONÁALVES VIANA NETO;IFCE,  OUTROS;ENGENHARIAS;BANNER
9761;ASTRONOMIA E SUA NARRATIVA: UMA EXPERI NCIA NO ENSINO M…DIO;LAIS LIMA ASSUNÁ„O, PAULO DOS SANTOS CORREIA;IFBA;CI NCIAS HUMANAS;BANNER
9750;GEST√O DE RESÕDUOS HOSPITALARES ñ ESTUDO DE CASO DE QUATRO HOSPITAIS P⁄BLICOS MARANHENSES;DÈBORAH EVILLYN LEMOS BATISTA, ROBERTA NEVES ALCANTARA, FABRÕCIA DE LIMA BRITO;IFMA;CI NCIAS BIOL”GICAS;BANNER
9749;ELABORA«√O DE BISCOITOS TIPO COOKIES COM FÕGADO BOVINO LIOFILIZADO;INGRID SOFIA VIEIRA MELO, JO„O GOMES DA COSTA, TASCYA MORGANNA DE MORAIS SANTOS, JACQUELINE  VIEIRA DA SILVA;EMBRAPA,  IFAL;CI NCIAS AGR¡RIAS;BANNER
9743;PARQUE CESAMAR: UMA ALTERNATIVA DE LAZER EM PALMAS, TOCANTINS;ALINE GOMES SANTANA, GERUZA ALINE ERIG, JULIANA VIDAL BATISTA, MAYELE CRISTINA DE ANDRADE FERREIRA;IFTO;CI NCIAS SOCIAIS APLICADAS;BANNER
9741;O L⁄DICO NO ENSINO DE CI NCIAS: O JOGO ìINCLUZOOî COMO RECURSO PEDAG”GICO PARA A INCLUS√O ESCOLAR DE CRIAN«AS COM DEFICI NCIA INTELECTUAL NA CIDADE DE MARCO-CE;ANA KAROLINA MELO RODRIGUES, SINARA SOCORRO DUARTE ROCHA;IFCE;MULTIDISCIPLINAR;ORAL
9740;AN¡LISE DA INCID NCIA DE RADIA«√O SOLAR NAS SALAS DE AULA DO IFPB, CAMPUS CAJAZEIRAS;HAYANNE MELLO DE MACÍDO, HIRLEY PINHEIRO DE SOUZA, RAFAEL PONCE DE LEON AMORIM;IFPB;CI NCIAS SOCIAIS APLICADAS;BANNER
9737;CARACTERIZA«√O FÕSICO-QUÕMICA DE FRUTOS DE LIMEIRA ¡CIDA ëTAHITIí SOBRE CINCO PORTA-ENXERTOS;ANA JANAÌNA RODRIGUES, ANTONIA THALYTA SILVEIRA, DÈBORA COSTA BASTOS, FRANCISCO LEANDRO LOUREIRO, PAHLEVI AUGUSTO SOUZA;EMBRAPA,  IFCE;CI NCIAS AGR¡RIAS;BANNER
9730;SA⁄DE EM CENA: NA PREVEN«√O DAS IST/ HIV/AIDS ENTRE ADOLESCENTES NO INTERIOR DE PERNAMBUCO;ANA GABRIELA VELOZO DE MELO CORDEIRO, JANICLECIA DOS SANTOS ALVES, KERLLANE RAFAELLA FREIRE DO NASCIMENTO SANTOS, SILVANA CAVALCANTE DOS SANTOS, VICTOR BARBOSA DE AZEVEDO;IFPE;CI NCIAS DA SA⁄DE;BANNER
9728;IMPLANTA«√O DO BANCO DE EST¡GIO, EMPREGO E CURRÕCULO DO INSTITUTO FEDERAL DO TRI¬NGULO MINEIRO ñ IFTM;EURÌPEDES RONALDO  ANANIAS FERREIRA;IFTM;MULTIDISCIPLINAR;ORAL
9727;EDUCAR O OLHAR: A VALORIZAÁ„O DA BELEZA E ESTÈTICA NEGRA COMO FORMA DE COMBATE AO RACISMO;ALICE ALVES LIMA, JULIANA PROTACIO SANTOS, PATRICIA DURANS CARDOSO, ROBERTA LOB√O CARVALHO;IFMA;CI NCIAS HUMANAS;BANNER
9724;AVALIAÁ„O E CONSCIENTIZAÁ„O DO CONSUMO DE ENERGIA ELÈTRICA PREDIAL EM UM CAMPUS DO INSTITUTO FEDERAL;DEUSDETE DE SOUSA  BRITO, RICHARDSON DA SILVA FURTADO SANTANA;IFMA;ENGENHARIAS;BANNER
9719;O POTENCIAL DA PLACA RASPBERRY PI COMO FERRAMENTA MEDIADORA PARA O PROCESSO DE ENSINO-APRENDIZAGEM;AYSLA MYLENE FERREIRA DA ROCHA, DIEGO SILVEIRA COSTA NASCIMENTO, GISELE ROGERIA PENATIERI;IFRN;MULTIDISCIPLINAR;BANNER
9717;AN¡LISE DA PRODU«√O URBANA DE RESÕDUOS S”LIDOS NO MUNICÕPIO DE PALMAS-TO, BRASIL.;ELAINE  DA CUNHA SILVA PAZ, GEORGE MATHEUS RODRIGUES TEIXEIRA, HEMYLLYANO CLAYSON ARA˙JO, MAGDA CRISTINA FERREIRA DE ARA⁄JO GOMES, MARCELO  MENDES PEDROZA;IFTO,  OUTROS;ENGENHARIAS;BANNER
9713;O LIVRO DID¡TICO DE BIOLOGIA DO 3∫ SEGMENTO DO ENSINO M…DIO DA EJA EM FLORIANO-PI: AS CONCEP«’ES DE ALUNOS E PROFESSORES;HERBERT  BRITO;IFPI;MULTIDISCIPLINAR;BANNER
9708;UTILIZA«√O DA MANTA ASF¡LTICA COMO IMPERMEABILIZANTE DE LAJES EXPOSTAS VISANDO A REDU«√O DE PROBLEMAS E CUSTOS;HERON ALVES COELHO, JESSIEVANE JARDER  COELHO DA SILVA, LUIDSON MACEDO NASCIMENTO, NICOLE GIOVANA  MENEZES ROCHA;IFTO;ENGENHARIAS;ORAL
9705;O ENSINO DE LIBRAS NO ENSINO M…DIO: RELATO DE EXPERI NCIA;ALICE CRISTINA  SOUZA LACERDA MELO DE SOUZA, CAMILA  BUDIM LOPES, KELLY  CRISTINA SOUZA BORGES, VANIELE  SOUZA OLIVEIRA, WELITON  NASCIMENTO ALEXANDRE;IFRO,  OUTROS;CI NCIAS HUMANAS;BANNER
9704;PARQUES E”LICOS E IMPACTOS AMBIENTAIS: UM ESTUDO SOBRE O ASSENTAMENTO ZUMBI EM RIO DO FOGO/RN;DANIELE  LUIZ DA SILVA, DANUZIA  LIRA DE S· CABRAL, ELIS‚NGELA  CORREIA DA CUNHA;IFRN;CI NCIAS HUMANAS;BANNER
9703;COMPORTAMENTO BIOM…TRICO DO UMBUZEIRO NO SERID” E CURIMATA⁄ PARAIBANO;TALITA KELLY PINHEIRO LUCENA;IFPB;CI NCIAS BIOL”GICAS;BANNER
9699;DESENVOLVIMENTO E CARACTERIZA«√O FÕSICO-QUÕMICA DE QUIBE DE CARNE DE CAPOTE (NUMIDA MELEAGRIS);ADRICIA  MELO;IFCE;CI NCIAS AGR¡RIAS;BANNER
9695;LIXO ELETRÙNICO: COMO MINIMIZAR SUAS CONSEQUÍNCIAS EM BUSCA DE UMA INFORM·TICA SUSTENT·VEL NO INSTITUTO FEDERAL DO PIAUÌ ñ CAMPUS FLORIANO?;LISA MARIA  BARBOSA BRITO FERREIRA DE ARA˙JO;IFPI;MULTIDISCIPLINAR;BANNER
9692;A MULHER E O JORNAL: O PERFIL DA IMPRENSA FEMININA PENEDENSE DO INÕCIO DO S…CULO XX;AGUIMARIO PIMENTEL SILVA, ALYSSON MELO DE SANTANA, ANNE KAROLYNNE SANTOS SOUZA, LETÕCIA FRANCIELY DE ALMEIDA SILVA;IFAL;CI NCIAS SOCIAIS APLICADAS;BANNER
9691;EDUCA«√O E SA⁄DE: A VIS√O DE PROFESSORES DE ENSINO FUNDAMENTAL SOBRE PARASITOSES;ISABELA VIEIRA DOS SANTOS MENDONÁA, JHONATAN WENDELL TAVARES FERREIRA, LEONARDO DE OLIVEIRA SOUZA, MIRIAN LIMA CAVALCANTE, NALYANNE SANTOS DE MELO;IFMA;CI NCIAS DA SA⁄DE;BANNER
9688;ELABORA«√O E AVALIA«√O SENSORIAL DE BISCOITO COM BIOMASSA DE BANANA VERDE ENRIQUECIDO COM FIBRAS;ALINE LÌVIA  SILVA OLIVEIRA;IFCE;CI NCIAS AGR¡RIAS;BANNER
9687;CONCLUINTES DO ENSINO MÈDIO RUMO ‡ UNIVERSIDADE;TIRZA DOMINIK  MARTINS DE ABREU;IFTO;MULTIDISCIPLINAR;BANNER
9686;CARACTERIZA«√O FISICO-QUÕMICA DA BEBIDA LACT…A DE MARACUJ¡-DO-MATO (PASSIFLORA CINCINNATA MAST) ¿ BASE DE SORO DE LEITE;ESTEF‚NIA  PRATES RODRIGUES, HIGO  SILVA ALVES, LUCAS  BRITTO LANDIM, NORMANE  MIRELE CHAVES DA SILVA, VANDILSON  PEREIRA JUNQUEIRA;IFBA,  OUTROS;CI NCIAS AGR¡RIAS;BANNER
9683;A PR¡TICA EM MICROBIOLOGIA COMO INSTRUMENTO DE ENSINO-APRENDIZAGEM;JAIANE CARM…LIA MONTEIRO VIANA, JONAS LUIZ ALMADA DA SILVA;IFRN;CI NCIAS BIOL”GICAS;ORAL
9682;AN¡LISE DO FLICKER PERCENTUAL EM DRIVERS PARA LEDS;F·BIO DE PAIVA NERES, MAXWELL  BRUNO;IFCE;ENGENHARIAS;ORAL
9674;AVALIA«√O DO DESEMPENHO T…CNICO DE ARGAMASSA COMERCIAL DE REJUNTAMENTO COM ADI«√O DE P” DE BORRACHA DE PNEU;AUGUSTO SERGIO DE MEDEIROS SILVA, EDILBERTO VITORINO DE BORJA, JOSÈ EURICO DE QUEIROZ;IFRN;ENGENHARIAS;BANNER
9672;AVALIA«√O FÕSICO-QUÕMICA DE DIFERENTES CULTIVARES DE PIMENT’ES (CAPSICUM ANNUUM L.);ELCIVAN PEREIRA OLIVEIRA, ELISMAR PEREIRA DE OLIVEIRA, HIGO DA SILVA DIAS, PAULO T˙LIO DE SOUZA SILVEIRA, YAGO C‚NDIDO PEREIRA DA SILVA;IFBA;CI NCIAS AGR¡RIAS;BANNER
9669;AVALIA«√O MORFOM…TRICA DE ATTALEA SPECIOSA NA BAHIA;AIRAN DOS SANTOS PROT·ZIO, ANA CAMILA OLIVEIRA FREITAS FREITAS, DHAYLA TARINE OLIVEIRA BRAGA, FABIANA ZANELATO BERTOLDE, V‚NIA LIMA SOUZA;IFBA;CI NCIAS BIOL”GICAS;BANNER
9664;CRESCIMENTO E PRODUTIVIDADE DA BETERRABA DE MESA FERTILIZADA COM URINA DE VACA;DIEGO CARVALHO DE MACEDO, JANDEILSON ALVES DE ARRUDA, JOSÈ  LUCÌNIO DE OLIVEIRA FREIRE, MANUELA DA SILVA MORAIS;IFPB;CI NCIAS AGR¡RIAS;BANNER
9663;CONSIDERA«’ES SOBRE A FLEXIBILIZA«√O DO FRAMEWORK WEB BIODIVERSITY COLLABORATIVE MODELLING SERVICES;KARLA  DONATO FOOK, SIMONY LINDALVA CANTANHEDE NUNES;IFMA;CI NCIAS EXATAS E DA TERRA;BANNER
9662;TECNOLOGIAS SOCIAIS NO SEMI¡RIDO ALAGOANO;ARTHUR BRENO ST‹RMER, EDUARDO SANTANA DA SILVA;IFAL;MULTIDISCIPLINAR;BANNER
9657;UTILIZA«√O DE UMA APLICA«√O PARA O ENSINO DE DETERMINANTE: UMA ABORDAGEM PARA ALUNOS DO 2∫ ANO DO ENSINO M…DIO;THALIANE  RAMOS GOMES;IFPI;CI NCIAS EXATAS E DA TERRA;BANNER
9655;AVALIA«√O DE SOFTWARE EDUCATIVO VOLTADO PARA O ENSINO DE CI NCIAS;CARMEM  DUARTE LIMA CAMPOS, ISABELA VIEIRA DOS SANTOS MENDONÁA, JHONATAN WENDELL TAVARES FERREIRA, PAULA CRISTINA COSTA CASTRO;IFMA;CI NCIAS HUMANAS;BANNER
9650;AVALIA«√O DA QUALIDADE DE AMOSTRAS DO G NERO BACCHARIS SP. ASTERACEAE (CARQUEJA) COMERCIALIZADAS EM PALMAS, TO, BRASIL;DANNIELA PRÌSCYLLA  VASCONCELOS FALEIRO;IFTO;CI NCIAS DA SA⁄DE;BANNER
9645;UTILIZA«√O DE UMA APLICA«√O PARA O ENSINO DE DETERMINANTE: UMA ABORDAGEM PARA ALUNOS DO 2∫ ANO DO ENSINO M…DIO;THALIANE  RAMOS GOMES;IFPI;MULTIDISCIPLINAR;BANNER
9639;CONSTRUCIONISMO ENQUANTO INOVA«√O PEDAG”GICA: DA CRISE PARADIGM¡TICA A UM PARADIGMA EMERGENTE;JAQUELINE DA SILVA RUM„O, SANDRA ANTONIELLE GARCÍS MORENO, WAGNER SOUSA SILVA;IFMA;CI NCIAS HUMANAS;BANNER
9637;SKATE: DE ATIVIDADE DE LAZER/ESPORTE NAS RUAS PARA AS AULAS DE EDUCA«√O FÕSICA NO ENSINO FUNDAMENTAL I;EDNA  NASCIMENTO;IFRN;CI NCIAS DA SA⁄DE;BANNER
9635;XI CONGRESSO NORTE NORDESTE DE PESQUISA E INOVAÁ„O, 2016 P·GINA 1 CONFLITOS SOCIOAMBIENTAIS DA IMPLANTA«√O DE ¡REA VERDE EM ¡REA DE OCUPA«√O IRREGULAR EM CORRENTE, PIAUÕ;LAÈCIO MIRANDA MIRANDA CUNHA;IFPI;MULTIDISCIPLINAR;BANNER
9633;"PERCURSOS DO SIL NCIO NO ROMANCE ""LEITE DERRAMADO"", DE CHICO BUARQUE";JOSE UESLEI LIMA DIAS, YVONÈLIO NERY FERREIRA;UFAC;LINGUÕSTICA, LETRAS E ARTES;ORAL
9631;COMPARAÁ„O ENTRE AS TOPOLOGIAS ATIVA E PASSIVA DE UM MISTURADOR PARA APLICAÁ„O EM RECEPTOR DE BAIXO CONSUMO;EMMANUEL BENÙIT JEAN-BAPTISTE DUPOUY, JOSÈ ANDERSON SILVA SANTOS, PEDRO HENRIQUE FREITAS SILVA;IFPB;ENGENHARIAS;BANNER
9629;AVALIA«√O E PROPOSTA DE RECUPERA«√O DE ¡REA DEGRADADA NO MUNICÕPIO DE CORRENTE, PIAUÕ;BRUNA DE FREITAS IWATA, EDINEUZA AZEVEDO COSTA, ISRAEL LOBATO ROCHA, ITALO RÙMULO MENDES DE SOUZA, TANCIO GUTIER AILAN COSTA;IFPI;MULTIDISCIPLINAR;BANNER
9624;APRENDIZAGEM BASEADA EM PROBLEMAS: UM M…TODO DE APRENDIZAGEM APLICADO AO CURSO DE TECNOLOGIA EM GEST√O AMBIENTAL DO IFRN;SAMIR CRISTINO DE SOUZA;IFRN;CI NCIAS HUMANAS;ORAL
9623;REFLEX’ES SOBRE A DOC NCIA NA EDUCA«√O PROFISSIONAL;THALITA  ALVES DOS SANTOS;IFS;CI NCIAS HUMANAS;BANNER
9622;AVALIA«√O MICROBIOL”GICA DA ¡GUA DISTRIBUÕDA NO BAIRRO VERMELH√O, CORRENTE-PI;MONYZIA  SOUZA;IFPI;CI NCIAS DA SA⁄DE;BANNER
9621;ENCANTO DOS ASTROS: ASTRONOMIA AO ALCANCE DE TODOS;ANDERSON NASCIMENTO SILVA, DOUGLAS VIEIRA LEITE, GABRIEL SANTANA RIBEIRO, JEAN HENRIQUE MENEZES NASCIMENTO, JERÙNIMO AQUINO ANDRADE;IFS;MULTIDISCIPLINAR;BANNER
9615;O TRANSPORTE FERROVI¡RIO COMO MEIO DE DESENVOLVIMENTO DO TURISMO EM SERGIPE;CLAUDENICE  DIAS, GLEYSIANE DA SILVA ANDRADE, JOYCE BARRETO PINTO SANTANA, MARIA DA GLÛRIA CORDEIRO SOUZA, TAMIRES COSTA SANTOS;IFS;CI NCIAS SOCIAIS APLICADAS;ORAL
9604;EVOLU«√O BIOL”GICA DAS ESP…CIES NO ENSINO M…DIO: UMA AN¡LISE CONCEITUAL EM UMA ESCOLA PARTICULAR EM FLORIANO/PI;JOEDSON DE SOUSA ALMEIDA, MAURÌCIO DOS SANTOS ARA˙JO, MICHELLE MARA DE OLIVEIRA LIMA;IFPI;CI NCIAS BIOL”GICAS;BANNER
9603;UBKEYS: OTIMIZA«√O DA SEGURAN«A E ORGANIZA«√O INSTITUCIONAL;JESSYCA  AGUIAR, PATRÌCIA  LIMA;IFRR;CI NCIAS EXATAS E DA TERRA;BANNER
9600;AVALIA«√O DA COMUNICA«√O NA EAD NO CAMPUS PALMEIRA DOS ÕNDIOS: A PERSPECTIVA DO ALUNO;ANTÙNIO FRANCISCO DE ASSIS SOBRINHO, EDMARA  DOS SANTOS DRIGO;IFAL;MULTIDISCIPLINAR;BANNER
9599;A OCUPA«√O DE ESPA«OS ALTERNATIVOS DE LAZER NO MUNICÕPIO DE ITACOATIARA/AM;BIANCA PAR· DIAS;IFAM;CI NCIAS DA SA⁄DE;BANNER
9598;PLANEJAMENTO DE EVENTOS RELIGIOSOS: A FESTA DO DIVINO ESPÕRITO SANTO EM NATIVIDADE - TOCANTINS;ALINE GOMES SANTANA, GERUZA ALINE ERIG, MAYELE CRISTINA FERREIRA DE ANDRADE;IFTO;CI NCIAS SOCIAIS APLICADAS;ORAL
9597;DETERMINA«√O DE CURVAS CARACTERÕSTICAS E ASSOCIA«√O DE BOMBAS CENTRÕFUGAS EM UM SISTEMA HIDR¡ULICO;DOUGLAS DE MENEZES  SANTOS, EVERTON CAIO DE OLIVEIRA  MIRANDA, JO„O VITOR DE SANTANA  OLIVEIRA, LAERCIO DE OLIVEIRA  SOUZA JUNIOR, RAIMISON BEZERRA DE  ASSIS;IFBA;ENGENHARIAS;BANNER
9595;A CONTRIBUI«√O DO ENSINO E.B.T.T., O DI¡LOGO INSTITUCIONAL E A EFETIVIDADE DOS CURSOS T…CNICOS NO INSTITUTO FEDERAL DE ALAGOAS ñ CAMPUS MARAGOGI;RUDSON MATHEUS OLIVEIRA;IFAL;CI NCIAS HUMANAS;ORAL
9593;HIERARQUIZA«√O DOS CURSOS Dí¡GUA DO PARQUE NACIONAL DA NASCENTES DO RIO PARNAÕBA;RAIANE  OLIVEIRASOUZA;IFPI;MULTIDISCIPLINAR;BANNER
9591;DIAGN”STICO DAS CONDI«’ES HIGI NICO-SANIT¡RIAS DA ESTRUTURA FÕSICA E FUNCIONAL DE COZINHAS DE ESCOLAS P⁄BLICAS MUNICIPAIS DE MURICI, ALAGOAS, BRASIL;MAYCON GOMES ARAUJO;IFAL;CI NCIAS AGR¡RIAS;ORAL
9586;AVALIA«√O DA DESCOLORA«√O DE UM EFLUENTE CONTENDO CORANTE UTILIZANDO DIFERENTES PROCESSOS OXIDATIVOS;IARA BARROS VALENTIM;IFAL;ENGENHARIAS;ORAL
9581;FITOMASSA E DISTRIBUI«√O DE RAÕZES DE ADUBOS VERDES CULTIVADOS EM SOLO DE TABULEIRO COSTEIRO, PENEDO, ALAGOAS;ANDERSON  MORAES SANTOS, DANIELLE  BRAGA TAVARES VASCONCELOS DA SILVA, DANILO C…SAR OLIVEIRA DE CERQUEIRA, EDMAÕRIS  RODRIGUES ARA⁄JO, FERNANDA KARINA PEREIRA DA FONSECA;IFAL;CI NCIAS AGR¡RIAS;BANNER
9576;DIFERENTES CONCENTRA«’ES DE EUGENOL PARA ANESTESIA DE JUVENIS DE TAMBATINGA COLOSSOMA MACROPOMUM X PIARACTUS BRACHYPOMUS EM MANEJO DE BIOMETRIA;EMANUEL SOARES DOS SANTOS, IANA MELO ARA˙JO, JOSÈ IVAN VASCONCELOS FONTELES FILHO, MARIA SAMARA ALVES DE FREITAS, TARCIO GOMES DA SILVA;IFCE;CI NCIAS AGR¡RIAS;BANNER
9573;QUANTIFICA«√O BIOM…TRICA EM PL¬NTULAS DE CACAUÕ (THEOBROMA SPECIOSUM WILD EX. SPRENG.);ABRAH„O RODRIGUES ALVES, MARCUS VINÌCIUS MACEDO DE PAIVA, RITALIA BRAGA VENANCIO, RIZIA DOS SANTOS ANTUNES, VANDERLEI ANTONIO STEFANUTO;IFAM;CI NCIAS BIOL”GICAS;BANNER
9572;A EVAS√O ESCOLAR NO CURSO T…CNICO SUBSEQUENTE DE INFORM¡TICA PARA INTERNET EAD DO IFRO;ADONIAS SOARES DA SILVA JUNIOR, DAIANA CAVALCANTE GOMES, DINALVA BARBOSA DA SILVA FERNADES, LADY DAY PEREIRA DE SOUZA;IFRO;CI NCIAS HUMANAS;BANNER
9571;REDUÁ„O DA TOXICIDADE AGUDA DE COBRE POR SUBST‚NCIA H˙MICA AQU·TICA, UTILIZANDO O ORGANISMO-TESTE ARTÍMIA SALINA;NATASCHA BRAGA BRAGA;IFAM;MULTIDISCIPLINAR;BANNER
9570;OBSERVA«√O PARTICIPANTE: T…CNICA DE INVESTIGA«√O NA FORMA«√O DOCENTE;DEUZILENE  SALAZAR;IFAM;CI NCIAS HUMANAS;ORAL
9569;ATUA«√O DOS AGENTES MODELADORES DO ESPA«O URBANO NO CONJUNTO SANTO ANT‘NIO DA CIDADE DE OLHO Dí¡GUA DAS FLORES-AL;DÈBORA DA SILVA OLIVEIRA, MARYANA VIEIRA FERREIRA DE OLIVEIRA, MATTEUS FREITAS DE OLIVEIRA, RANIELLI OLIVEIRA BARBOSA, VICTÛRIA DO CARMO SILVA;IFAL;CI NCIAS HUMANAS;BANNER
9568;O ENSINO DA FOTOSSÕNTESE PARA ALUNOS DA ZONA RURAL:  PROJETO ìLUZ DA VIDA: CI NCIA QUE ALIMENTA A AMAZ‘NIAî;ADRIANO PEREIRA DA SILVA MARTINS, ALEXANDRE RICARDO VON ENHERT, CRISCIAN KELLEN  AMARO DE OLIVEIRA, JAIDSON BRAND„O DA COSTA, JOSÈ PINHEIRO QUEIROZ-NETO;IFAM,  OUTROS;MULTIDISCIPLINAR;ORAL
9564;OS DESAFIOS DA SEGURAN«A DA INFORMA«√O NA ADO«√O DO BYOD ìTRAGA SEU PR”PRO DISPOSITIVOî;DOUGLAS CASTELO RAMOS, JOHNNY ROCHA CRISOSTOMO, THAIS CAROLAINY NUNES MARIANO, THAYNARA  SOUSA;IFCE;MULTIDISCIPLINAR;BANNER
9563;CONSCIENTIZA«√O AMBIENTAL: PROCESSO DE EDUCA«√O E TRANSFORMA«√O SOCIAL;AMANDA MARTINS ALMEIDA;IFPB;MULTIDISCIPLINAR;BANNER
9560;ìVALEI-ME S√O JORGEî: POBREZA E AGENTES NO SUB-BAIRRO S√O JORGE , ALTO DO URUBU, BATALHA-AL.;ANTHONY FARIAS ROCHA, JOSÈ JEFFERSON RODRIGUES DA SILVA, JOSÈ WELLINGTON DA SILVA, MATTEUS FREITAS DE OLIVEIRA, PABLO GUILHERME TENÛRIO DE MELO;IFAL;CI NCIAS HUMANAS;ORAL
9558;DA INCONSTITUCIONALIDADE DO PROJETO DE EMENDA ¿ CONSTITUI«√O FEDERAL N∫ 171/93;ANA BEATRIZ  ALVES PIMENTEL;IFRN;CI NCIAS HUMANAS;BANNER
9557;O NÕVEL DE FORMA«√O E EXPERTISE DOS GESTORES DESPORTIVOS DOS SERT’ES DE CANIND….;BASÌLIO ALMEIDA  ROMMEL FECHINE, ELÌDIA COELHO  BIÈ, FRANCISCA EDYA  ESTEVES DE LIMA, KELLYABREU  DOS SANTOS, MARIA JANAÌNA  LUSTOSA SOUTO;IFCE;CI NCIAS SOCIAIS APLICADAS;BANNER
9556;CARACTERÕSTICAS MORFOM…TRICAS, ZOOT…CNICAS E FATOR DE CONDI«√O DE GUPPIES POECILIA RETICULATA PROVENIENTES DE DOIS AMBIENTES;EMANUEL SOARES DOS SANTOS, IANA MELO ARA˙JO, JOSÈ IVAN VASCONCELOS FONTELES FILHO, MARIA SAMARA ALVES DE FREITAS, TARCIO GOMES DA SILVA;IFCE,  OUTROS;CI NCIAS AGR¡RIAS;BANNER
9552;CUSTEIO ABC APLICADO ¿ MOVIMENTA«√O DE MATERIAIS: UM ESTUDO DE CASO EM UMA EMPRESA DO RAMO DE METALURGIA;CARLOS DAVID PINHEIRO, FRANCISCA MARIA GUERRA, FRANCISCO JAIMISON PEREIRA, MATHEUS MELO MOTA;IFCE;ENGENHARIAS;BANNER
