8259;PRODU«√O DE MORANGOS AUXILIADA PELA TECNOLOGIA ARDUÕNO PARA EXERCER O CONTROLE DE HUMIDADE DO SOLO, DO AR E DA TEMPERATURA;BRUNO ROVER DAL PR·, EBERSON TAYNAN TOMAZELLI, JOSÈ LEONARDO ALVES LEITE;IFRO;CI NCIAS EXATAS E DA TERRA;BANNER
8255;ALGORITMO PREMIUM: UM SOFTWARE DESTINADO A INCLUS√O DE APRENDIZES COM DEFICI NCIA INTELECTUAL NOS CURSOS EM INFORM¡TICA;DÈBORA DE OLIVEIRA CARVALHO DAMASCENO, IAN DE BRITO DE AZEVEDO, LIA ALESSANDRA DA SILVA  MARTINS, MANUELA PERES VASCONCELOS;IFAM;CI NCIAS EXATAS E DA TERRA;BANNER
8252;EFEITO DO EXERCÕCIO FÕSICO AGUDO SOBRE O ESVAZIAMENTO G¡STRICO DE UMA REFEI«√O LÕQUIDA EM ACAD MICOS DE EDUCA«√O FÕSICA;BRUNA LUIZA FREITAS MOISÈS, JESSYKA RAQUEL SILVA SOUSA, JULIANA  ZANI DE ALMEIDA, MARESSA  SANTOS FERREIRA, RÙMMULO CELLY LIMA SIQUEIRA;IFCE;CI NCIAS DA SA⁄DE;ORAL
8244;AN¡LISE ESTATÕSTICA SOBRE O COMPORTAMENTO DA COMUNIDADE DO IFBA, CAMPUS SALVADOR, NO DESCARTE DE PILHAS E BATERIAS;EMILY DE SANTANA TEIXEIRA, FRANCISMARI NORONHA DOS SANTOS, GABRIEL BEANES BONFIM DIAS SILVA, RAFAEL MENEZES ASSUNÁ„O;IFBA;CI NCIAS EXATAS E DA TERRA;BANNER
8242;AVALIA«√O DOS PAR¬METROS PRODUTIVOS NO MILHO VERDE EM DIFERENTES L¬MINAS DE IRRIGA«√O EM SISTEMAS POR GOTEJAMENTO;DAMIANA  HELAINE;IFCE;CI NCIAS AGR¡RIAS;BANNER
8241;AN¡LISE COMPUTACIONAL DE ENSAIO DE TENACIDADE ¿ FRATURA EM TUBOS DA IND⁄STRIA PETROLÕFERA;FELIPE  AUGUSTO CRUZ, RÙMULO  MEDEIROS DE ANDRADE;IFPE;ENGENHARIAS;BANNER
8237;FLORÕSTICA E FITOSSOCIOLOGIA DE ESP…CIES OCORRENTES EM RESERVA LEGAL, POVOADO ANDIROBA, BARREIRINHASñMA;RAFAEL  SOUSA DOS SANTOS, …VILLE KARINA RIBEIRO-NOVAES;IFMA;CI NCIAS BIOL”GICAS;ORAL
8235;A CAIXA DE PANDORA: DESENVOLVIMENTO TECNOLÛGICO E DESIGUALDADES SOCIAIS;DAYANA BEZERRA BEZERRA DE SOUZA, YGOR OLINTO ROCHA CAVALCANTE;IFAM;CI NCIAS HUMANAS;BANNER
8230;INTERDISCIPLINARIDADE ENTRE CURSOS DE TI E A MATEM¡TICA UTILIZANDO O ALGORITMO DE GAUSS-JORDAN IMPLEMENTADO EM LINGUAGEM COMPUTACIONAL PARA PRATICAR ¡LGEBRA LINEAR;DIOGO CHADUD MILAGRES, LUZIT‚NIA  DALL'AGNOL;IFMS;CI NCIAS EXATAS E DA TERRA;BANNER
8227;SCREENING FITOQUÕMICO, DETERMINA«√O DE COMPOSTOS FEN”LICOS E ATIVIDADE ANTIOXIDANTE DE EXTRATOS COMERCIAIS DE PR”POLIS;ADRIANA DOS SANTOS SILVA, AMANDA BARBOSA WANDERLEY, PATRÌCIA BELTR„O LESSA CONSTANT, TICIANO GOMES DO NASCIMENTO, VALDEMIR DA COSTA SILVA;UFAL,  UFS;CI NCIAS AGR¡RIAS;ORAL
8224;PLANTAS MEDICINAIS DE BARREIRINHAS, MARANH„O: UM ESTUDO ETNOBOT‚NICO;SUELEM  ARA˙JO, …VILLE KARINA RIBEIRO-NOVAES;IFMA;CI NCIAS BIOL”GICAS;BANNER
8217;EDUCA«√O ESPECIAL NA PERSPECTIVA INCLUSIVA: UMA REVIS„O DAS LEGISLAÁıES DA EDUCAÁ„O ESPECIAL E INCLUSIVA E SEUS IMPACTOS NO ATENDIMENTO DE ALUNOS COM DEFICIÍNCIA NO INSTITUTO FEDERAL DO AMAZONAS, CAMPUS MAUÈS.;MAXILIANO BATISTA BARROS;IFAM;CI NCIAS HUMANAS;BANNER
8214;AVALIA«√O DA ATIVIDADE ANTIMICROBIANA DOS ”LEOS ESSENCIAIS DE OCIMUM GRATISSIMUM L. E CYMBOPOGON CITRATUS EM APRESUNTADOS;ABIGAIL LEE FREESE, CAROLINE DE OLIVEIRA RIBEIRO, NÈLIO RANIELI FERREIRA DE PAULA, REBEKAH ANNE FREESE, VANDERLEY ANTONIO CHOROBURA KLEIN;IFRO;CI NCIAS AGR¡RIAS;BANNER
8212;POR UM NOVO PARADIGMA: UMA PROPOSTA DE DISCUSS√O ACERCA DA DIVIS√O DOS CONTE⁄DOS DA GEOGRAFIA ESCOLAR;ANA PAULA  TORRES DE QUEIROZ, DILTON ARLINDO  DOS SANTOS JUNIOR, RAPHAEL  FONTOURA DA SILVA;IFPE;CI NCIAS HUMANAS;BANNER
8203;AVALIA«√O DE DIFERENTES MODALIDADES DE SEMEADURAS COM DOIS TIPOS DE SEMENTES BLINDADAS E N√O BLINDADAS AVALIADAS EM TR S …POCAS DE CORTE NO CONE SUL DE ROND‘NIA;ERNANDO  BALBINOT, PATRÕCIA  ORLANDO ROYER, RAFAEL HENRIQUE PEREIRA DOS REIS, ROBERLAN  FERREIRA DA SILVA, THIAGO  DE SOUZA RIZZI;IFRO;CI NCIAS AGR¡RIAS;BANNER
8193;DESENVOLVIMENTO DE BALA DE GELATINA COM ADI«√O DE POLPA E ALBEDO DE MARACUJ¡;ANA PAULA STORT FERNANDES, L˙CIA SCHUCH BOEIRA, KIRKY FRANCINE DA COSTA;IFAM;CI NCIAS AGR¡RIAS;BANNER
8191;DESPERTANDO VOCA«’ES PARA A LICENCIATURA EM GEOGRAFIA: DESAFIOS E POSSIBILIDADE DE SER PROFESSOR.;RAPHAEL  FONTOURA;IFPE;CI NCIAS HUMANAS;BANNER
8190;INVESTIGA«√O DOS DIST⁄RBIOS DAS VIBRA«’ES NO MOTOR DE INDU«√O ENERGIZADO COM TENS’ES DESEQUILIBRADAS;ALEXANDRE  MAGNO FERREIRA DINIZ, ALMIR  NERY GALV„O JUNIOR, MATHEUS  FELIPE DOS SANTOS SOUZA, ROBSON  ROBSON TAVEIRA GONÁALVES DA SILVA, RÙMULO  DINIZ ARA˙JO;OUTROS;ENGENHARIAS;ORAL
8178;ELABORA«√O DE FERMENTADO DE CARAMBOLA: AVALIA«√O FÕSICO-QUÕMICA E SENSORIAL;ANDERSON AQUINO LEIRIA, L˙CIA SCHUCH BOEIRA, NICOLLE RIBEIRO UCHÙA, PAULO HENRIQUE BASTOS FREITAS;IFAM;CI NCIAS AGR¡RIAS;BANNER
8176;DIN¬MICA DE P E K NO SOLO COM CULTIVO DE VIDEIRA ëIT¡LIAí SOB ADUBA«√O ALTERNATIVA E DIFERENTES L¬MINAS DE IRRIGA«√O;VICTOR  PIMENTA;IF SERT√O-PE;CI NCIAS AGR¡RIAS;BANNER
8175;ARRANJOS PRODUTIVOS LOCAIS: AS POLÕTICAS P⁄BLICAS DE APOIO AO APL DE BORDADOS EM S√O JO√O DOS PATOS ñ MA E SEUS IMPACTOS;CYNARA  BARROS DE MORAES, MARCOS AUR…LIO  PEREIRA RODRIGUES, RAFAELA FERNANDA  CARVALHO BARBOSA, TARCÕSIO  SOUZA DE S¡;IFMA;CI NCIAS SOCIAIS APLICADAS;BANNER
8174;INF¬NCIA NEGRA E ÕNDIA NOS REGISTROS DE BATISMO EM MANAUS (1820-1834);IVANELISON  MELO DE SOUZA, YGOR OLINTO ROCHA CAVALCANTE;IFAM;CI NCIAS HUMANAS;BANNER
8173;MAPEAMENTO E IDENTIFICA«√O DAS PRA«AS DA CIDADE DE FORTALEZA-CE;ANDERSON DA SILVA BARROS, HORTÍNCIA ALVES NOGUEIRA, JO„O PAULO DA COSTA FELIPE, PAULO CÈSAR CUNHA LIMA, RAYSSA DE SOUSA CARNEIRO;IFCE;CI NCIAS SOCIAIS APLICADAS;BANNER
8166;TEATRO, PIBID E PROEMI: UMA PESQUISA EXPLORATÛRIA SOBRE METODOLOGIAS DE ENSINO INOVADORAS E INCLUSIVAS;CLEOMAR  VIEIRA DA SILVA, FERNANDO  DA SILVA OLIVEIRA, SOLANGE  CAVALCANTE DE MATOS;IFTO;LINGUÕSTICA, LETRAS E ARTES;ORAL
8165;ESTUDO DE VIABILIDADE T…CNICA E ECON‘MICA PARA A INSTALA«√O DE MICROUSINAS GERADORAS DE ENERGIA SOLAR FOTOVOLTAICA EM UNIDADES DO INSTITUTO FEDERAL DA BAHIA;ANILSON CERQUEIRA GOMES, MILSON MATOS LIMA J˙NIOR, SHEDEN OLIVEIRA LOPES JUNIOR;IFBA;ENGENHARIAS;BANNER
8162;AVALIA«√O DA VARIABILIDADE FÕSICO-QUÕMICA DE DERIVADOS DO BENEFICIAMENTO DA MANDIOCA PRODUZIDOS EM CIDADES DO EXTREMO SUL DA BAHIA;GUTTO MONZELLE RIOS MARQUES, JOYCE SOUZA FERNANDES, JO„O VICTOR DA SILVA SANTOS, THAÌS METZKERP PINTO;IFBA;CI NCIAS AGR¡RIAS;BANNER
8160;A MENSURA«√O DA QUALIDADE DOS SERVI«OS DE BARES E RESTAURANTES DO MUNICÕPIO DE MARECHAL DEODORO/AL;ARIELLY SALDANHA MOURA;IFAL;CI NCIAS SOCIAIS APLICADAS;BANNER
8158;ELABORA«√O DO MAPA DE RISCOS DO LABORAT”RIO DE INOVA«√O EM APROVEITAMENTO DE RESÕDUO E SUSTENTABILIDADE ENERG…TICA DO IFTO ñ CAMPUS PALMAS;LUCIANE  DE PAULA MACHADO;IFTO;MULTIDISCIPLINAR;BANNER
8153;DESTINAÁ„O DE RESÌDUOS SÛLIDOS: ESTUDO DE CASO DE UMA PEDREIRA EM MACAÌBA/RN;VLADEMIR  HENRIQUE;IFRN;ENGENHARIAS;BANNER
8151;EVID NCIAS BIBLIOGR¡FICAS SOBRE A IMPORT¬NCIA DAS INSTITUI«’ES FINANCEIRAS PARA O CRESCIMENTO ECON‘MICO NO BRASIL;ANNA CECÌLIA CHAVES GOMES, IRISLAN  CONCEIÁ„O, KATARINA CHAVES LACERDA, LUIZ ANTÙNIO FELIX JUNIOR, TATIANA LOSANO DE ABREU;FPB,  IFPB;CI NCIAS SOCIAIS APLICADAS;BANNER
8150;ESTUDO DE VIABILIDADE T…CNICA E ECON‘MICA PARA A INSTALA«√O DE MICROUSINAS GERADORAS DE ENERGIA SOLAR FOTOVOLTAICA EM UNIDADES DO INSTITUTO FEDERAL DA BAHIA;SHEDEN  JUNIOR;IFBA;ENGENHARIAS;BANNER
8147;AVALIA«√O DO POTENCIAL DE APROVEITAMENTO DAS ¡GUAS DESCARTADAS POR DESTILADORES PARA IRRIGA«√O;FRANCISCO GLEISSON PAIVA AZEVEDO;IFCE;ENGENHARIAS;BANNER
8146;A SOCIALIZA«√O ORGANIZACIONAL E SUA RELA«√O COM O DESEMPENHO PROFISSIONAL DOS COLABORADORES DO SERVI«O NACIONAL DE APRENDIZAGEM DO COOPERATIVISMO DA PARAÕBA (SESCOOP/PB);MARIA LUIZA DA COSTA SANTOS, MARIA MOTA GARCIA DA SILVA, MAYKON BARBOSA VIANA, THALITA DE LIMA MENEZES;IFPB;CI NCIAS SOCIAIS APLICADAS;BANNER
8145;EDUCA«√O AMBIENTAL: SUA APLICABILIDADE EM ESCOLAS P˙BLICAS NO MUNICÌPIO DE BAIA DA TRAIÁ„O/PB.;MARIA BET‚NIA SILVA DANTAS;IFPB;MULTIDISCIPLINAR;BANNER
8140;UMA ABORDAGEM PARA AVALIA«√O DO JOGO DID¡TICO ìJOGO GIRO DO ¡LCOOL NA CIDADEî;DEUSA SOUZA SANTOS, FRANCISCO LUIZ GUMES LOPES, HELENA ROBERTO BONAPARTE NETA, M…RCIA MICHELLY MENEZES ¡VILA DE S¡, ROSANNE PINTO DE ALBUQUERQUE MELO;IFS;MULTIDISCIPLINAR;BANNER
8139;DESENVOLVIMENTO E INVESTIGA«√O DA ATIVIDADE ANTIOXIDANTE DE MEMBRANA POLIM…RICA ¿ BASE DE PR”POLIS VERMELHA PARA O TRATAMENTO DA ⁄LCERA POR PRESS√O.;ABIANE  MARIA GOMES DE SOUZA SILVA, ILZA FERNANDA BARBOZA DUARTE, IRINALDO  DINIZ BASÌLIO J˙NIOR, JACQUELINE  ANTARES DINIZ BASÌLIO, VALDEMIR  DA COSTA SILVA;UFAL;CI NCIAS DA SA⁄DE;BANNER
8133;DA CONSTRU«√O NORMATIVA DAS COOPERATIVAS DE TRABALHO SEGUNDO OS DITAMES DA LEI N∫ 12.690/12;ROCCO ANTONIO RANGEL ROSSO NELSON;IFRN;CI NCIAS SOCIAIS APLICADAS;BANNER
8130;AVALIAÁ„O MICROBIOLÛGICA DE AMÍNDOAS DA CASTANHA DO CAJU PROCESSADAS ARTESANALMENTE E INDUSTRIALIZADAS COMERCIALIZADAS NA CIDADE DE PICOS-PI.;KENIO  OLIVEIRA;UFPI;CI NCIAS DA SA⁄DE;BANNER
8129;EQUINOCULTURA NO MUNICÕPIO DE AMAJARI: SISTEMA DE PRODU«√O, SANIDADE E NUTRI«√O;WILMA  GONÁALVES DE FARIA;IFRR;CI NCIAS AGR¡RIAS;BANNER
8128;CARACTERIZA«√O DE MAT…RIAS PRIMAS UTILIZADAS EM FORMULA«√O DE MASSAS CER¬MICAS;CÈSAR ROGÈRIO MENEZES SILVA, ELENISE BARRETO BARBOSA ANUNCIAÁ„O, FRANCISMARI NORONHA DOS SANTOS;IFBA;ENGENHARIAS;BANNER
8124;CARACTERIZA«√O QUÕMICA DE RESÕDUOS DE PEGMATITOS DA REGI√O DO SERID” - RN  PARA INCORPORA«√O EM MASSAS CER¬MICAS;ARTHUR DENIS DANTAS DE LIMA, FLANELSON MACIEL MONTEIRO, MARCONDES  MENDES DE SOUZA;IFBA,  IFRN;ENGENHARIAS;BANNER
8123;PLANEJAMENTO, SÌNTESE E AVALIAÁ„O ANTI-TRYPANOSOMA CRUZI DE NOVO DERIVADO AMINOGUANIDINA HIDRAZONA;MIGUEL ANGELO SANTOS PINHEIRO-SEGUNDO, NAYARA MARIA SIQUEIRA LEITE, SYBELLE CHISTIANNE BATISTA DE LACERDA PEDROSA, THIAGO MENDONÁA AQUINO, VALERIA REGO ALVES PEREIRA;UFAL,  UFPEL,  UNIVASF;CI NCIAS DA SA⁄DE;ORAL
8121;CONCEP«√O DE ADOLESCENTES DO SEXO FEMININO ACERCA DO CORPO: BELEZA X SA⁄DE X ATIVIDADE FÕSICA;ANA CAROLINE FERREIRA CAMPOS DE SOUSA, BRUNO  NUNES, FRANKLEY MARLYSON DE OLIVEIRA ALBUQUERQU, RICHARDSON  CORREIA MARINHEIRO, TATIANA VALERIA DA SILVA QUEIROZ;IFPB;CI NCIAS DA SA⁄DE;BANNER
8119;PERFIL DAS DESIGUALDADES INTRAMUNICIPAIS NO ESTADO DE ALAGOAS, ATRAV…S DA AN¡LISE ESTATÕSTICA MULTIVARIADA;LYLIAN DAYSE  MATIAS DA SILVA;IFAL;CI NCIAS SOCIAIS APLICADAS;BANNER
8115;AVICULTURA COMO ALTERNATIVA DE DESENVOLVIMENTO SUSTENT¡VEL EM COMUNIDADE QUILOMBOLA DO MARANH√O;EDNALDO BEZERRA DOS SANTOS, FL·VIA MAYRANNE GONÁALVES DOS SANTOS, KERLEN EMANUELE PINTO DA SILVA, LEILA MEDEIROS RIBEIRO, MARIA VERONICA MEIRA DE ANDRADE;IFMA,  OUTROS;CI NCIAS AGR¡RIAS;ORAL
8110;AVALIA«√O DA QUALIDADE DO SANEAMENTO AMBIENTAL NO MUNICÕPIO DE VALEN«A DO PIAUÕ/PI;ANNA KELLY MOREIRA DA SILVA, FRANCISCO ANDERSON VIEIRA DE SOUSA, JORD‚NIA CATARINA SOUSA E SILVA, JORGE HENRIQUE SILVA J˙NIOR;IFPI;MULTIDISCIPLINAR;BANNER
8107;FEBRE CHIKUNGUNYA E SUAS IMPLICA«’ES NA QUALIDADE DE VIDA DAS PESSOAS ACOMETIDAS;ALINE MIRELY NUNES DOS SANTOS SILVA, ANA CARLA SILVA ALEXANDRE, VERÙNICA ALVES DE ALMEIDA;IFPE;CI NCIAS DA SA⁄DE;BANNER
8103;O USO DA REDE SOCIAL E SUA INFLU NCIA NA COMUNICA«√O DAS ORGANIZA«’ES;JANAINA  KAICA DOS REIS ALMEIDA, LELLYA  ALVES BARBOSA, MARCOS  AURÈLIO PEREIRA RODRIGUES, RAFAELA FERNANDA CARVALHO BARBOSA, TARCÌSIO  SOUZA DE S·;IFMA;CI NCIAS SOCIAIS APLICADAS;BANNER
8102;UM RETRATO DAS ATIVIDADES DO SERVI«O NACIONAL DE APRENDIZAGEM DO COOPERATIVISMO DA PARAÕBA;ARETHA  DO NASCIMENTO SANTANA, JOSÈ ELBER MARQUES BARBOSA;IFPB;CI NCIAS SOCIAIS APLICADAS;BANNER
8098;CHUVECO ñ CHUVEIRO ECOL”GICO MICRO CONTROLADO POR ARDUINO;JACKSON  AZEVEDO;IFRN;CI NCIAS EXATAS E DA TERRA;BANNER
8097;DESENVOLVIMENTO E CARACTERIZA«√O DE MICROENCAPSULADOS DA PR”POLIS VERMELHA DE ALAGOAS;ABIANE MARIA GOMES DE SOUZA SILVA, ILZA FERNANDA BARBOZA BUARTE, IRINALDO DINIZ BASÌLIO J˙NIOR, JACQUELINE ANTARES DINIZ BASÌLIO, VALDEMIR DA COSTA SILVA;UFAL;CI NCIAS DA SA⁄DE;BANNER
8092;A IMPORT¬NCIA DO EST¡GIO SUPERVISIONADO NO PROCESSO DE FORMA«√O DE ALUNOS DO ENSINO PROFISSIONAL INTEGRADO AO ENSINO M…DIO DO CAMPUS PARAÕSO DO TOCANTINS DO IFTO;POLIANA MARTINS MARINHO BARROS;IFTO;MULTIDISCIPLINAR;BANNER
8091;ESTUDO DO TRANSTORNO DO ESPECTRO AUTISTA NO MUNICÕPIO DE PALMAS-TO;ANA CAROLINA NOGUEIRA FALC„O, ELAINE  PAZ, INGRID SILVA REIS, PAULO  PAZ NETO;IFTO;CI NCIAS HUMANAS;BANNER
8089;QUÌMICA NO COTIDIANO;ANTONY  EVANGELISTA DE LIMA, GEORGE ALEXANDRE DA SILVA FRANCO, MARCELO RAMON DA SILVA FRANCO, ¬NGELO  GOMES DE MELO;IFAC,  IFRN;MULTIDISCIPLINAR;BANNER
8088;AN¡LISE E SIMULA«√O DE FILTROS DE MICROFITA UTILIZANDO A GEOMETRIA MATRIOSKA;ALFREDO GOMES NETO, ANDRECIA PEREIRA DA COSTA, JOSEFA GILLIANE DE OLIVEIRA MARIANO, JULIETE DA SILVA SOUZA, THAYUAN ROLIM DE SOUSA;IFPB;ENGENHARIAS;BANNER
8081;PRODU«√O DE MEL√O ëPELE DE SAPOí CULTIVADO EM SOLO TRATADO COM PLANTAS ANTAGONICAS AP”S INFESTADO COM NEMATOIDES DAS GALHAS;ANTONIO DE ASSIS CARVALHO MOREIRA, BEATRIZ  ABREU ARAUJO, FRANCISCA GLEICIANE NASCIMENTO LOPES, FRANCISCO JOSÈ CARVALHO MOREIRA, MARIA ELIS‚NGELA SOUSA SILVA;IFCE;CI NCIAS AGR¡RIAS;BANNER
8080;CONHECENDO COMUNIDADE TRADICIONAL DE MATRIZ AFRICANA : O TERREIRO DE CANDOMBL… ìIL  AS… APAR¡ ODARAî, EM XAPURI-AC,  COMO EXPRESS√O DE RESIST NCIA E AFIRMA«√O IDENTIT¡RIA;JOSÈ ARIMATEIA OLIVEIRA;IFAC;CI NCIAS HUMANAS;BANNER
8076;A MÕDIA EXTERIOR EM MANAUS NA VIS√O DAS AG NCIAS DE PUBLICIDADE QUE ATENDEM A PREFEITURA;EVERTON  ARRUDA, LUIZ FELIPE DANTAS GRIMM D`FARIAS;IFAM;CI NCIAS SOCIAIS APLICADAS;BANNER
8072;ATIVIDADE ANTIOXIDANTE DE DERIVADOS 5-NITRO-TIOFENO-TIOSSEMICARBAZONAS;JAMERSON FERREIRA DE OLIVEIRA, LARA MENEZES MELO OLIVEIRA, LUIZ NASCIMENTO DE ARA˙JO NETO, MARIANA DO EGITO ROS·RIO, ODJA ALEXANDRA GAMA VIEIRA;UFPEL;CI NCIAS DA SA⁄DE;BANNER
8070;DESENVOLVIMENTO DE UM ROB‘ NO AUXÕLIO DE PESSOAS COM LIMITA«’ES DE LOCOMO«√O;ANNYZIA MARIA FERREIRA FONSECA, BRENO MEIRA MOURA AMORIM, DANIEL WANDERLEY  HONDA, FRANKLIS MELO  OLIVEIRA, HALANE LYLLIAN BESERRA SOUSA;IFRN;ENGENHARIAS;BANNER
8068;SÕNTESE, CARACTERIZA«√O ESTRUTURAL E AVALIA«√O ESQUISTOSSOMICIDA E LEISHMANICIDA DE DERIVADOS CARBOTIOAMIDAS-IND”LICOS;AMÈLIA GALDINO RIBEIRO, ANTÙNIO SÈRGIO ALVES DE ALMEIDA JR, JOSÈ CLEBERSON SANTOS SOARES, MARIA DO CARMO ALVES DE LIMA, MÙNICA CAMELO PÍSSOA DE AZEVEDO ALBUQUERQUE;UFPEL;CI NCIAS DA SA⁄DE;BANNER
8067;UTILIZANDO UMA FERRAMENTA BPMS PARA AGREGAR VALOR A PROCESSOS DE NEG”CIO: INTEGRANDO CONCEITOS DE BPM E SOA;JO„O AUGUSTO DIAS TEIXEIRA, PAULA PATRÌCIA OLIVEIRA DA SILVA;IF BAIANO;CI NCIAS EXATAS E DA TERRA;BANNER
8059;DESENVOLVIMENTO DE UM SISTEMA DE VIS√O DE M¡QUINA DE BAIXO CUSTO PARA BRA«OS ROB”TICOS INDUSTRIAIS;B·RBARA GRAZIELLE FIRMINO DE ARA˙JO, JULIERME SILVA DE ARA˙JO, RAFAEL FRANKLIN ALVES SILVA;IFPB;ENGENHARIAS;BANNER
8057;INVESTIGANDO A RESILIÍNCIA DA COMUNIDADE DE CASTAINHO, GARANHUNS-PE ASPECTOS ASSOCIADOS ‡S PR·TICAS AMBIENTAIS NA RELAÁ„O COM A NATUREZA;JÈSSICA  DANTAS;IFPE;MULTIDISCIPLINAR;BANNER
8055;O PAPEL DO MONITOR NO DESEMPENHO DAS ATIVIDADES TE”RICO PR¡TICAS NA ASSIST NCIA DE ENFERMAGEM: RELATO DE EXPERI NCIA NO COMPONENTE CURRICULAR DE EMERG NCIA;ANA CARLA SILVA ALEXANDRE, MANUELA  SIQUEIRA, MARIA DO SOCORRO DE OLIVEIRA COSTA;IFPE;CI NCIAS DA SA⁄DE;BANNER
8053;ESTUDO DE CER¬MICAS VERMELHAS COMERCIALIZADAS NA REGI√O DE SALGUEIRO-PE;EMANOEL SILVA CARVALHO, JULIMAR SILVA BATISTA, MARCELO SOUZA DA SILVA, VICTOR ALVES SOARES;IF SERT√O-PE;ENGENHARIAS;BANNER
8049;AN¡LISE ESTRUTURAL DO QUADRO DE UMA BICICLETA;MAYKON DE SANTANA ALMEIDA, PATRÌCIA DA SILVA OLIVEIRA, RICARDO CARDOSO SOARES;IFPI;ENGENHARIAS;BANNER
8040;A INFLUÍNCIA DO SUBSTRATO NA GERAÁ„O DE FILMES AUTO ARRANJADOS DE ESFERAS DE L·TEX POR EVAPORAÁ„O CONTROLADA DE SOLVENTE (ECS).;ANTONY  ERNESTO;IFAL;CI NCIAS EXATAS E DA TERRA;BANNER
8039;FALANDO NISSO: A NEWSLETTER DO INSTITUTO FEDERAL DO TOCANTINS;KELINNE OLIVEIRA GUIMAR„ES, MAIARA SOBRAL SILVA, MOISÈS LAURENCE DE FREITAS LIMA J˙NIOR;IFTO;CI NCIAS SOCIAIS APLICADAS;BANNER
8038;PIBID EM COMPUTA«√O: INTEGRA«√O ENTRE ENSINO B¡SICO E INFORM¡TICA NUMA ABORDAGEM INTERDISCIPLINAR;CREIDIANE  BRITO, LEANDRO  MIRANDA, SILVELANE  PEREIRA;IFBA;MULTIDISCIPLINAR;BANNER
8037;AS CONTRIBUI«’ES DOS ASPECTOS COGNITIVOS E EMOCIONAIS NO DESENVOLVIMENTO AFETIVO;BRUNA ANGÈLICA BORGES, ELIS‚NGELA DE CARVALHO FRANCO;IFRO;CI NCIAS HUMANAS;ORAL
8035;A QUALIDADE DE VIDA DOS ALUNOS DO PROJOVEM URBANO DA CIDADE DE JUAZEIRO DO NORTE;ANA CRISTINA PEREIRA CASTRO, CÌCERO EDUARDO DE SOUZA C‚NDIDO, DEBORAH SANTANA PEREIRA, JOSÈ NAZARENO BEZERRA SILVA, ROBÈRIO PAIVA CASTRO;IFCE,  UFC;CI NCIAS DA SA⁄DE;BANNER
8033;DIAGN”STICO DA GEST√O DA ENERGIA EL…TRICA NO IFBA, CAMPUS DE SALVADOR;ARMANDO  HIROHUMI TANIMOTO, DANILO DE JESUS PINTO, FERNANDO SÈRGIO  DOS SANTOS J˙NIOR, PRISCILA A M MOTA, VICTOR BEN-HUR  NEVES ARA˙JO;IFBA;ENGENHARIAS;ORAL
8032;AN¡LISE DO CULTIVO HIDROP‘NICO NO CARIRI CEARENSE COMO ALTERNATIVA DE PRODU«√O EM LARGA ESCALA;BRENDA MANUELE DA ROCHA LIMA, IVONILDO DOS SANTOS SILVA, JOELMA LIMA OLIVEIRA, MARIA LUCINEIDE GOMES SILVA, SÛSTENES GOMES DE SOUSA;IFCE;CI NCIAS AGR¡RIAS;BANNER
8029;A OBRA EMÌLIO E OS LUMENS: O QUINTO PODER, COMO MATERIAL DID·TICO NOS CURSOS DE LICENCIATURA DA UNIVERSIDADE FEDERAL DO PIAUÌ ñ CAFS, UM MÈTODO PEDAGÛGICO EXPERIMENTAL.;LUCAS OLIVEIRA DE OLIVEIRA LIMA;UFPI;CI NCIAS HUMANAS;BANNER
8026;BOVINOCULTURA DE LEITE NO MUNICÕPIO DE AMAJARI: SANIDADE E SUPLEMENTA«√O MINERAL;WILMA  GONÁALVES DE FARIA;OUTROS;CI NCIAS AGR¡RIAS;BANNER
8024;VIABILIDADE DO USO DE PR·TICAS CULTURAIS NA RECUPERAÁ„O DE FRUTÌFERAS EM ARIQUEMES-RO;CAIQUE GUIMAR„ES CABRAL, DAVID BRAGA CASTRO, GECIELLE SOARES FREITAS, LENITA APARECIDA CONUS VENTUROSO, LUCIANO REIS VENTUROSO;IFRO,  UNIR;CI NCIAS AGR¡RIAS;BANNER
8021;DESENVOLVIMENTO DE UM DISPOSITIVO ELETR‘NICO EMBARCADO PARA AN¡LISE DE  ”LEOS VEGETAIS  E DE SEU POTENCIAL  PARA APLICA«√O COMO ISOLANTE EL…TRICOS;BITARAN DOS SANTOS MELO;IFMA;ENGENHARIAS;BANNER
8016;VANTAGEM COMPETITIVA DA INOVA«√O TECNOL”GICA NO SETOR DO AGRONEG”CIO BRASILEIRO.;JOSEANE PINHEIRO DE LIMA, JOSICLEIDE BATISTA DA SILVA, LILIANE PEREIRA DA SILVA;IFRN;CI NCIAS AGR¡RIAS;BANNER
8013;FECHADURA ELETR‘NICA UTILIZANDO ARDUÕNO;DÈBORA CAROLINE DE AZEVEDO PEREIRA;IFRN;ENGENHARIAS;BANNER
8011;A FORMA«√O DA REDE URBANA DA AMAZ‘NIA;HUDINILSON KENDY YAMAGUCHI, VALERY NICOLAS BACELLAR, ELIAS  MORAES;IFAM;CI NCIAS HUMANAS;BANNER
8009;AVALIA«√O VEGETATIVA INICIAL DE HÕBRIDOS DE BANANEIRA SOB MANEJO AGROECOL”GICO EM SOUSA-PB;ARTHUR CABRAL PEREIRA DOS SANTOS, GIUSEPPE MANOEL DANTAS MELO, JAILSON DO CARMO ALVES, JO√O JONES DA SILVA, MARCUS DAMI√O DE LACERDA;IFAL,  IFPB;CI NCIAS AGR¡RIAS;BANNER
8006;O ENSINO DE CI NCIAS E OS PCNS: PERCEP«√O DE PROFESSORES DA EDUCA«√O B¡SICA SOBRE A PR¡XIS EDUCATIVA;ANTONIO WESLLEY SILVA, MARCIO EDUARDO GONCALVES, MAYARA BEZERRA ANDRADE, MÙNGOLA KEYLA FREITAS ABREU, SARA JANE OLIVEIRA;IFCE,  OUTROS;MULTIDISCIPLINAR;BANNER
8001;POTENCIAL ALELOP¡TICO DE ABUBOS VERDES NA GERMINA«√O DE SEMENTES DE PLANTAS DANINHAS;DANILO CÈSAR OLIVEIRA DE CERQUEIRA, EDMAÌRIS RODRIGUES ARA˙JO, IVAN LISBOA ARA˙JO, JOSÈ MADSON DA SILVA, MICHELANGELO DE OLIVEIRA SILVA;IFAL;CI NCIAS AGR¡RIAS;BANNER
7999;AN¡LISE DAS DIFEREN«AS ENTRE A COMPACTA«√O DOS SOLOS PELOS M…TODOS MANUAL E MEC¬NICO;MANOEL DOS SANTOS PEREIRA J˙NIOR;IFCE;ENGENHARIAS;BANNER
;;;;;
7996;A GEST√O FINANCEIRA E A ASSIST NCIA T…CNICA COMO FERRAMENTAS PARA A CONSOLIDA«√O DA ECONOMIA NA AGRICULTURA FAMILIAR;DARYEL HENRIQUE ABREU DE QUELUZ, GELZA CARLIANE MARQUES TEIXEIRA, MARCOS ANTONIO PEREIRA DOS SANTOS, NATANAEL COSTA TELES, …RICA RIBEIRO DE SOUSA SIMONETTI;IFTO;CI NCIAS AGR¡RIAS;BANNER
7993;CORDEL AFRODESCENDENTE E SUA CONTRIBUI«√O NO APRENDIZADO DAS RELA«’ES …TNICO-RACIAIS;MARIA VERONICA MEIRA DE ANDRADE, ZILMARA SOUZA ALMADA;IFMA;CI NCIAS HUMANAS;BANNER
7987;O CEN¡RIO DA EDUCA«√O A DIST¬NCIA  NO INSTITUTO FEDERAL DA PARAÕBA;CRISTINA ROTHIER DUARTE, GIRLENE MARQUES FORMIGA;IFPB;CI NCIAS HUMANAS;BANNER
7983;O PERFIL SOCIECON‘MICO DOS PRODUTORES DE HORTALI«AS DO MUNCIPIO DE CRATO - CE;FRANCISCO HUGO HERMÛGENES ALENCAR, GIRLAINE SOUZA DA SILVA ALENCAR, MARIA LUCINEIDE  GOMES DA SILVA, SOSTÈNES GOMES SOUSA;IFCE;MULTIDISCIPLINAR;BANNER
7978;DESENVOLVIMENTO DE UM CONVERSOR SEPIC PARA CARREGAMENTO DE BATERIA DE CHUMBO ¡CIDO PARA UM SISTEMA E”LICO DE BAIXA POT NCIA;ENRIQUE PETER RIVAS PADILLA, ¡TILA DA CONCEIÁ„O MACEDO;IFBA;ENGENHARIAS;BANNER
7977;ENERGIA FOTOVOLTAICA INTEGRADA ¿ REDE DE DISTRIBUI«√O: ECONOMIA E SUSTENTABILIDADE PARA O IFMA E ESCOLAS ESTADUAIS DE BACABAL - MA;PEDRO ALVES FONTES;IFMA;CI NCIAS EXATAS E DA TERRA;BANNER
7976;EDUCAÁ„O ESPECIAL_ UM ESTUDO DE CASO;NAT·LIA DE OLIVEIRA MARTINS;IFBA;CI NCIAS HUMANAS;BANNER
7974;PROJETO SUSTENT¡VEL DE UMA ESCOLA RIBEIRINHA EM MADEIRA COM ASSOCIA«√O DE MATERIAIS AC⁄STICOS E T…RMICOS;LAERTE MELO BARROS, VINICIUS DOS SANTOS ALBUBERQUE;IFAM;ENGENHARIAS;BANNER
7971;LETRAMENTO LINGUÕSTICO E MATEM¡TICO: IMPACTOS NO RENDIMENTO ESCOLAR DA EDUCA«√O B¡SICA;KELVISSON RODRIGUES CARVALHO;IFPI;LINGUÕSTICA, LETRAS E ARTES;BANNER
7968;AS COMUNIDADES QUILOMBOLAS NO BRASIL: ENTRE A RESIST NCIA E O RECONHECIMENTO.;CORREIA  DOS SANTOS;IFAL;CI NCIAS HUMANAS;ORAL
7964;VALORA«√O ECON‘MICA: UM ESTUDO DE CASO DO PARQUE ESTADUAL DUNAS DE NATAL;ANDRÈ LUÌS  BARROS;IFRN;MULTIDISCIPLINAR;BANNER
7963;ESTUDO DA PERDA DE CARGA EM CURVAS USANDO O M…TODO DOS ELEMENTOS FINITOS;DANIEL COIMBRA OLIVEIRA, MARTA GABRIELA ARAUJO AMORIM;IFMA;ENGENHARIAS;BANNER
7957;SOCIABILIDADE URBANA E VIDA DE BAIRRO NA BOMBA DO HEMETÈRIO, RECIFE-PE;ADAUTO  GOMES BARBOSA, GUSTAVO  MACIEL MAC·RIO DAS NEVES;IFPE;CI NCIAS HUMANAS;BANNER
7953;DESENVOLVIMENTO E AVALIAÁ„O SENSORIAL DE IOGURTE TIPO SUNDAE SABOR MELANCIA;ELAINE  SANTOS, HILANA  OLIVEIRA, MAYCON  ARA⁄JO;IFAL;CI NCIAS AGR¡RIAS;BANNER
7951;IDENTIFICA«√O N√O-LINEAR DE SISTEMAS VIA REDE NEURAL EM ESPA«O DE ESTADOS E FILTRO DE KALMAN UNSCENTED;ANDERSON PABLO EVANGELISTA, GINALBER LUIZ SERRA;IFMA;ENGENHARIAS;BANNER
7950;AN¡LISE DO M…TODO DOS ELEMENTOS DE CONTORNO PARA PLACAS FINAS;ANDRE  PEREIRA SANTANA, KERLLES RAFAEL PEREIRA SOUSA, MARTA GABRIELA ARAUJO AMORIM;IFMA;ENGENHARIAS;BANNER
7949;DESENVOLVIMENTO DE UM SOFTWARE DE ESTRATIFICA«√O DE SOLOS PARA ATERRAMENTO EL…TRICO;AFONSO AUGUSTO SANTANA SALES RIOS, LUIS ALVES CORREIA FILHO, ROGÈRIO GUSM„O MARINHO;FAINOR,  IFBA;ENGENHARIAS;BANNER
7947;FENOLOGIA DE ESP…CIES VEGETAIS OCORRENTES EM ¡REA DE CERRADO NO NORDESTE DO MARANH√O;DINNIE MICHELLE ASSUNÁ„O LACERDA, JUD¡ BEN-HUR ARA⁄JO BARROS, …VILLE KARINA RIBEIRO-NOVAES;IFMA,  UFMA;CI NCIAS BIOL”GICAS;BANNER
7938;EDUCAÁ„O AMBIENTAL: DIAGNÛSTICO DE PR·TICAS ASSOCIADAS AO USO DE AGROTÛXICOS E O DESTINO FINAL DE SUAS EMBALAGENS;ROSELY SOUZA PEREIRA;IFRR;CI NCIAS BIOL”GICAS;ORAL
7929;PADR’ES GERMINATIVOS EM SEMENTES DE JENIPAPEIRO (GENIPA AMERICANA)  SOB CONDI«’ES N√O CONTROLADAS;ABRAH„O RODRIGUES ALVES, MARCUS VINÌCIUS MACÍDO PAIVA, RITALIA BRAGA VEN‚NCIO, VANDERLEI ANTONIO STEFANUTO;IFAM;CI NCIAS BIOL”GICAS;BANNER
7926;ìA PRINCESA DO JURU¡î, A HIST”RIA E A MEM”RIA: EXPERIÍNCIAS DA CONSTRUÁ„O DE UMA MEMÛRIA HISTÛRICA DE EIRUNEPÈ ñ AM;ARICIA VIANA DE SOUZA, KELVEN KLIM  BARROSO PRASAD, PAULO DE OLIVEIRA NASCIMENTO, RODRIGO FERREIRA DE LIMA;IFAM;CI NCIAS HUMANAS;BANNER
7924;A VIS√O DA SOCIEDADE PERANTE O PERFIL EST…TICO DE NUTRICIONISTAS;KENIO SILVA OLIVEIRA;UFPI;CI NCIAS DA SA⁄DE;BANNER
7923;SISTEMATIZAÁ„O E INFORMATIZAÁ„O NA ASSISTÍNCIA ESTUDANTIL DO INSTITUTO FEDERAL DO TOCANTINS: MAPEAR A VULNERABILIDADE PARA FORTALECER A PERMANÍNCIA E O ÍXITO;CARANHATO  RODRIGUES;IFTO;CI NCIAS SOCIAIS APLICADAS;BANNER
7922;VIS√O E PARTICIPA«√O DE ALUNOS DO ENSINO M…DIO NAS ATIVIDADES DE EDUCA«√O AMBIENTAL EM UMA ESCOLA ESTADUAL DE GURUPI - TO;ALESSANDRO  OLIVEIRA, ANDRÈ FERREIRA DOS SANTOS, ELIANA AGMARA GONÁALVES DA SILVA, VIRGÌLIO LOURENÁO SILVA NETO;IFTO,  OUTROS,  UFT;CI NCIAS HUMANAS;BANNER
7919;QUEM … O INIMIGO? REFLEX’ES SOBRE O OUTRO NA TRINCHEIRA DA FRONTEIRA GLOBAL;ANNE FRANCIALY  DA COSTA ARA˙JO;IFAL;CI NCIAS HUMANAS;BANNER
7915;FRONTEIRAS, DESLOCAMENTOS E IDENTIDADE: O JOGO DA SEMELHAN«A E DA DIFEREN«A EM ìDOIS IRM√OSî, DE MILTON HATOUM;MARIA LUCIANE  DA SILVA;IFAL;LINGUÕSTICA, LETRAS E ARTES;ORAL
7910;PEGADA ECOLÛGICA NO IFBA- CAMPUS SALVADOR;ANA CLARA DA SILVA PINHO, SAMARA FERREIRA ANDRADE, VIVIAN SIQUEIRA DOS SANTOS;IFBA;MULTIDISCIPLINAR;BANNER
7907;IMPACTOS DO COLONIALISMO NA CONSTRU«√O DE IDENTIDADES: REFLEX’ES A PARTIR DE ìHIBISCO ROXOî, DE CHIMAMANDA NGOZI ADICHIE;MARIA LUCILENE  DA SILVA;IFAL;LINGUÕSTICA, LETRAS E ARTES;ORAL
7906;O MEIO AMBIENTE SOB O OLHAR DO AGENTE JOVEM AMBIENTAL;BRUNO DA MATA RODRIGUES, ELIELMA SANTANA FERNANDES, LEDIANE ARA˙JO SOUZA, ROSITA NASCIMENTO DE SENA;IFBA;MULTIDISCIPLINAR;BANNER
7904;APLICA«√O DA  METODOLOGIA DE ¡RVORE DE PROBLEMAS NA IDENTIFICA«√O DE PROBLEMAS AMBIENTAIS EM UMA COMUNIDADE ESCOLAR NO MUNICIPIO DE MANAUS;EDEVALDO ALBUQUERQUE FIALHO;IFAM;CI NCIAS HUMANAS;ORAL
7903;PERFIL DAS ADOLESCENTES GR¡VIDAS ATENDIDAS NA UNIDADE B¡SICA DE SA⁄DE NOVA ESPERAN«A NO MUNÕCIPIO DE LARANJAL DO JARI, AMAP¡ - BRASIL;ROBSON MARINHO ALVES;IFAP;CI NCIAS DA SA⁄DE;BANNER
7896;PRODU«√O DE ENZIMAS CELULOLÕTICAS ATRAV…S DA FERMENTA«√O EM ESTADO S”LIDO DO RESÕDUO DA ACEROLA POR PENICILLIUM ROQUEFORTI;GEORGE LIMA MARQUES, MARCELO  FRANCO, NADABE SANTOS REIS, TATIELLE PEREIRA SILVA;UESB,  UESC,  UFAL;ENGENHARIAS;BANNER
