11348;TRABALHANDO COM NOVAS METODOLOGIAS NO ENSINO DE MATEM¡TICA DANDO  NFASE A ESTATÕSTICA E PROBABILIDADE, NA ESCOLA MUNICIPAL FRANCISCO MENDES VIEIRA, EM S√O JO√O DOS PATOS ñ MA;JANNAYZA ALVES LIMA, MARISLANDE COSTA DE SOUSA, RODRIGO SOUSA DA SILVA, WILLAMS DA SILVA LIMA;IFMA;CI NCIAS EXATAS E DA TERRA;BANNER
11345;ADSOR«√O DE F”SFORO EM SOLOS DO SERID” PARAIBANO;JANDEILSON ALVES DE ARRUDA, JOAB JOSEMAR VITOR RIBEIRO DO NASCIMENTO, JOSÈ LUCÌNIO DE OLIVEIRA FREIRE, JOSÈ WELLINGTON DE MEDEIROS ESTRELA, SEBASTIANA JOELMA DE AZEVEDO SANTOS;IFPB;CI NCIAS AGR¡RIAS;BANNER
11339;NOTAS BIO…TICAS SOBRE AS CONSQU NCIAS DO TECNOCENTRISMO CIENTÕFICO PARA A VIDA HUMANA;IHELLOGIM ISIS DA COSTA FERREIRA;IFPB;CI NCIAS HUMANAS;ORAL
11337;INFLU NCIA DO HOR¡RIO DE COLETA E TEMPO DE SECAGEM NA COMPOSI«√O QUÕMICA DO ”LEO ESSENCIAL DE CROTON RHAMNIFOLIUS H.B.K.;CLAUDIA DE ALBUQUERQUE MARANH„O;IFPE;CI NCIAS EXATAS E DA TERRA;BANNER
11335;AN·LISE DO COMPORTAMENTO DA REDE DURANTE ATAQUE DE NEGAÁ„O DE SERVIÁO EM AMBIENTE VIRTUALIZADO;ANDRÈ HENRIQUE SOUSA DE MENEZES, KELVIN ROMERO MEIRA DE OLIVEIRA CORDEIRO, LEANDRO CAVALCANTI DE ALMEIDA, PAULO DITARSO MACIEL JR.;IFPB;CI NCIAS EXATAS E DA TERRA;BANNER
11326;DESENVOLVIMENTO DO SISTEMA DE ARMAZENAMENTO DE INFORMAÁ„O RURAL DO TERRITÛRIO SERT„O PRODUTIVO;FERNANDO  MIRANDA, REINALDO  COTRIM, TIAGO  FELIZ;IFBA;CI NCIAS EXATAS E DA TERRA;BANNER
11325;A ARTE DE CONTAR HIST”RIAS E SUA IMPORT¬NCIA NA FORMA«√O …TICA E INTELECTUAL DO CIDAD√O GREGO;BRIAN FERREIRA MARINHO;IFPB;CI NCIAS HUMANAS;BANNER
11324;EFICIÍNCIA DO MILHETO NO CONTROLE DE PLANTAS DANINHAS NO CULTIVO DE MELANCIA.;JOEDNA  SILVA, MARCELO ALVES TERRA, SAULO XAVIER MELO, THIAGO PEREIRA COSTA;IFTO;CI NCIAS AGR¡RIAS;BANNER
11322;SIMULA«√O DE CURVAS DE RADIA«√O SOLAR GLOBAL E AN¡LISE COMPARATIVA COM HIST”RICO DE ESTA«’ES METEOROL”GICAS;BRUNO  DE ALENCAR CARNEIRO;IFMA;ENGENHARIAS;BANNER
11316;SISTEMA DE CONTAGEM AUTOM¡TICA DE UNIDADES FORMADORAS DE COL‘NIAS DE BACT…RIAS EM PLACAS DE PETRI ATRAV…S DE T…CNICAS DE VIS√O COMPUTACIONAL;BIANCA SOUZA AUGUSTO, ELIZIANA VALENTIM DE ARA˙JO, KAMILA KELLY CARDOSO DE LIMA, NAYANNE DE CARVALHO UCHOA;IFCE;CI NCIAS EXATAS E DA TERRA;BANNER
11315;CONSTRU«√O DE UM GERADOR DE FUN«√O;LEANDRO ALMEIDA SANTOS, RAFAEL NASCIMENTO SILVA;IFBA;ENGENHARIAS;BANNER
11314;EVAS√O E RETEN«√O EM CURSOS DE LICENCIATURA;F·BIO  WOJTYSIAK CRUZ, JOCELMA  ALMEIDA RIOS, LUIZ EDUARDO  THOMAZ TEIXEIRA CABRAL, MARIA TERESINHA  TAMANINI ANDRADE, TEREZA  KELLY GOMES CARNEIRO;IFBA;CI NCIAS HUMANAS;BANNER
11312;ENSINO DE GEOGRAFIA EM ESCOLAS DO CAMPO: UM ESTUDO DE CASO NO MUNICÕPIO DE SANTA IN S/BA;CLÛVIS  SANTOS;IF BAIANO;CI NCIAS HUMANAS;BANNER
11311;A IMPORT¬NCIA DA QUALIDADE DA CAL NAS PROPRIEDADES FÕSICAS DAS ARGAMASSAS DE REVESTIMENTO NO ESTADO ENDURECIDO;GUSTAVO  MAIA;IFRN;ENGENHARIAS;ORAL
11309;IMPORT¬NCIA DA QUALIDADE DE CALES HIDRATADAS NA REOLOGIA DE ARGAMASSAS DE REVESTIMENTO NO ESTADO FRESCO;GUILHERME  MAIA;IFRN;ENGENHARIAS;BANNER
11305;ARBORIZAR;FELIPE  RIZZO;IFMA;CI NCIAS AGR¡RIAS;BANNER
11303;TRANSPOSI«√O DO RIO S√O FRANCISCO: CONSEQU NCIAS PARA OS MORADORES DA VILA BARTOLOMEU, MUNICÕPIO DE CAJAZEIRAS-PB;HIARLEY  MARTINS LIRA, LUIZ NELDECILIO ALVES VITOR, SARAHBELLE  LEITE CARTAXO;IFPB,  OUTROS;CI NCIAS HUMANAS;BANNER
11302;AVALIA«√O DA TEMPERATURA UMIDADE E PH SOB DIFERENTES COBERTURAS DE SOLO;PAULO HENRIQUE HENRIQUE MELO GADELHA;IFCE;CI NCIAS AGR¡RIAS;BANNER
11298;CAMINHOS DE APRENDIZADO: CONSIDERA«’ES SOBRE O USO DE TRILHAS ECOL”GICAS EM TRABALHOS DE EDUCA«√O AMBIENTAL;EDIANA TEIXEIRA DANTAS MENDES, JOSÈ ARAUJO  AMARAL, KHADJA VANESSA BRITO DE OLIVEIRA;IFRN;CI NCIAS HUMANAS;BANNER
11297;AN¡LISE FÕSICO-QUÕMICA E MICROBIOL”GICA DE IOGURTE CONCENTRADO DESENVOLVIDO COM POLPA DE BETERRABA;GABRIELA CRISTINA SILVA DE BRITTO;IFMT;CI NCIAS AGR¡RIAS;BANNER
11296;PERCEP«√O E OCUPA«√O DOS BAIRROS DE SANTANA DO IPANEMA AL PARA FINS DE DELIMITA«√O;JOSTEIN SCHINDLER GOIS;IFAL;CI NCIAS HUMANAS;BANNER
11294;O SUFIXO -INHO COMO ELEMENTO MODALIZADOR-DISCURSIVO;ANNA LIBIA ARAUJO CHAVES;IFPB;LINGUÕSTICA, LETRAS E ARTES;BANNER
11286;ESTUDO DO POTENCIAL DE GERA«√O DE BIOG¡S NA BIODEGRADA«√O DE RESIDUOS S”LIDOS URBANOS ENVELHECIDOS SUBMETIDOS ¡ PR¡TICA DE RECIRCULA«√O DE LIXIVIADO;MARIA ALICE DE LIRA BORGES;IFPE;ENGENHARIAS;ORAL
11285;INDICADORES DE SUSTENTABILIDADE NA BACIA HIDROGR¡FICA DO CAPIBARIBE, PERNAMBUCO, ATRAV…S DE ¡LGEBRA DE MAPAS;RAISSA SOUZA GOMES;IFPE;ENGENHARIAS;BANNER
11284;APLICA«√O DE SISTEMA FOTOVOLTAICO PARA CLIMATIZA«√O DE PARADAS DE ‘NIBUS;ALEXSIONE COSTA SOUSA, ARMYSTRON GONÁALVES ARA˙JO, WÍNIO FHAR· BORGES;IFPI;ENGENHARIAS;BANNER
11283;BAIRRO PEDRO SALES DE BARROS E OS AGENTES PRODUTORES DO ESPA«O URBANO EM OLHO Dí¡GUA DAS FLORES-AL;IZABELY MELO SILVA, JOANNA BEATRIZ ALMEIDA, MARIA EDUARDA MELO DA PAZ, MATTEUS FREITAS DE OLIVEIRA;IFAL;CI NCIAS HUMANAS;BANNER
11280;VALIDA«√O DE METODOLOGIA ANALÕTICA PARA QAUNTIFICA«√O DE ¡CIDOS GRAXOS VOL¡TEIS EM CROMATOGRAFIA LÕQUIDA;MARIA  ZILLENE;IFCE;ENGENHARIAS;BANNER
11277;PROJETO BHOIA - DESENVOLVIMENTO COMUNICA«√O SEM FIO;CARLOS EDUARDO DE CARVALHO, FRANCISCO GEOCLECIANO SOUSA DO NASCIMENTO, GILBERTO  SCHWERTNER, LUCAS DE BRITO SILVA, PALOMA SANTOS DE ALMEIDA;IFCE;CI NCIAS EXATAS E DA TERRA;BANNER
11271;CONSCIENTIZA«√O DOS DESPERDÕCIOS ALIMENTARES E OS IMPACTOS AMBIENTAIS NO MUNICÕPIO DE A«AIL¬NDIA - MA;DENISE SILVA DO AMARAL MIRANDA, EDIV‚NIA MELO AGUIAR, HELEN ROSENO FEITOZA LIMA, LORENA MARQUES GUIMAR„ES, SUELEN RACHEL SALES SILVA;IFMA;CI NCIAS BIOL”GICAS;BANNER
11265;LEVANTAMENTO DE ESP…CIES FLORESTAIS F…RTEIS OCORRENTES NO AMBIENTE DE V¡RZEA NO MUNICÕPIO DE L¡BREA, AMAZONAS;F·BIO GERALDO DE SOUZA, RICARDO APARECIDO BENTO;IFAM;CI NCIAS AGR¡RIAS;BANNER
11264;COMPARA«√O DOS M…TODO MONTE CARLO UTILIZADOS NA GERA«√O DE TRAB…CULAS ”SSEAS;ALEX CRISTOV„O OLIVEIRA, FERNANDA GONÁALVES OLIVEIRA, FERNANDO ANDRADE LIMA, JOSÈ WILSON VIEIRA, ARTHUR FELIPE GRACIANO ANDRADE;IFPE,  OUTROS;CI NCIAS EXATAS E DA TERRA;BANNER
11263;O ALUNO MONITOR: DESAFIOS DE CONSTITUIR SUJEITOS ATIVOS EM SALA DE AULA DE LÕNGUA PORTUGUESA;KATHIA MARIA  BARROS LEITE;IFAL;LINGUÕSTICA, LETRAS E ARTES;BANNER
11257;RELATO DE UMA EXPERI NCIA NO ENSINO DE L”GICA DE PROGRAMA«√O UTILIZANDO SIMULA«√O DE FUTEBOL DE ROB‘S;ELTON JOHN DE FRANÁA PEIXOTO DE LIMA;IFPE;MULTIDISCIPLINAR;BANNER
11256;FERRAMENTA DID·TICA PARA PR·TICAS DE IDENTIFICAÁ„O DE MINERAIS UTILIZANDO AS PROPRIEDADES FÌSICAS;DOUGLAS FERNANDES E SILVA FERREIRA, MARCOS AURÈLIO DE OLIVEIRA MAIA, SILAS SAMUEL DOS SANTOS COSTA;IFRN;CI NCIAS EXATAS E DA TERRA;BANNER
11253;DESIGUALDADE SOCIAL NA CAPITAL DO RIO GRANDE DO NORTE;GENIVAL TRAJANO TEIXEIRA, LEONARDO NASCIMENTO SIQUEIRA, MARCELINO FERNANDES JUNIOR, REGIRLANE CARVALHO SILVA, VIVIANE SOUZA SILVA;IFRN;CI NCIAS HUMANAS;BANNER
11252;PROPOSTA DE UTILIZA«√O DO GOOGLE DRIVE COMO EXTENS√O DA SALA DE AULA NAS ESCOLAS P⁄BLICAS DO ENSINO M…DIO;ANA WELYCA DE FREITAS BRITO;IFCE;MULTIDISCIPLINAR;BANNER
11239;PLANO DE FECHAMENTO DE MINA: UMA ALTERNATIVA PARA O AMBIENTE DA MINERAÁ„O;EDSON  NETO DOS SANTOS, MARIA BEATRIZ  VARELLA PEREIRA PINTO;IFRN;MULTIDISCIPLINAR;BANNER
11237;DESENVOLVIMENTO DE UM WEBSITE PARA A ACAPORD (ASSOCIA«√O CAMARENSE DE APOIO AOS PORTADORES DE DEFICI NCIA);DIEGO HENRIQUE OLIVEIRA DE SOUZA, EMELYN CLEMENTINO FREIRE;IFRN;MULTIDISCIPLINAR;BANNER
11233;ANEMÙMETRO MEC‚NICO DE BAIXO CUSTO;DÈBORA CAROLINE DE ARA˙JO PEREIRA, MOISÈS  MORAIS DE OLIVEIRA;IFRN;ENGENHARIAS;BANNER
11232;DESENVOLVIMENTO DE UMA UNIDADE DE ENSINO POTENCIALMENTE SIGNIFICATIVA PARA O ENSINO DE ELETRODIN¬MICA ORIENTADA POR UM PROT”TIPO INTERATIVO QUE UTILIZA A PLATAFORMA ARDUINO PARA CONTROLE DE DISPOSITIVOS E MEDIDAS EL…TRICAS.;BRUNO  GON«ALVES, PAULO HENRIQUE DIAS MENEZES, SILVIA COSTA ARAUJO;IFMG,  UFJF;CI NCIAS EXATAS E DA TERRA;BANNER
11231;CARACTERIZA«√O PRELIMINAR DOS IMPACTOS AMBIENTAIS AO LONGO DO RIO MUNDA⁄ EM MURICI ñ AL;JULYNNE ELISSA AGUIAR;IFAL;CI NCIAS AGR¡RIAS;BANNER
11230;NOMOFOBIA: O MEDO DE FICAR DESCONECTADO;DALILA VIT”RIA DA SILVA SANTOS;IFAL;MULTIDISCIPLINAR;BANNER
11228;AVASTEC: AMBIENTE VIRTUAL DE APRENDIZAGEM EM SISTEMA DE TELEFONIA CELULAR;CARLOS GOMES FONTINELLE;IFAM;CI NCIAS HUMANAS;BANNER
11227;MICORREMEDIAÁ„O DE EFLUENTE TÍXTIL IN NATURA E ASPECTOS LEGAIS ENVOLVIDOS;ANDREZA OLIVEIRA SANTOS;IFCE;ENGENHARIAS;BANNER
11224;PROJETO BHOIA ñ ESTUDOS SOBRE MOVIMENTA«√O HOLON‘MICA;CARLOS EDUARDO DE CARVALHO, FRANCISCO GEOCLECIANO SOUSA DO NASCIMENTO, GILBERTO  SCHWERTNER, LUCAS DE BRITO SILVA, PALOMA SANTOS DE ALMEIDA;IFCE;MULTIDISCIPLINAR;BANNER
11222;OS  JOGOS DID¡TICOS COMO INSTRUMENTO CRIATIVO NO PROCESSO DE ENSINO - APRENDIZAGEM;ERICA VIVIANE MIRANDA;IFAP;CI NCIAS HUMANAS;ORAL
11221;INF¬NCIA SUSTENT¡VEL: UM NOVO FUTURO;BEATRIZ  BOMTEMPO DE SIQUEIRA, MARIA BEATRIZ VARELLA PEREIRA PINTO, NATHALIA  MAIA DE MELO;IFRN;MULTIDISCIPLINAR;BANNER
11220;VALORES PESSOAIS PREDOMINANTES ENTRE COLABORADORES DE UMA INSTITUI«√O DE ENSINO SUPERIOR EM PARAÕSO DO TOCANTINS;SIMONE MATOS DOS SANTOS TEIXEIRA;IFTO;CI NCIAS SOCIAIS APLICADAS;BANNER
11216;HANS JONAS E O PRINCÕPIO DA RESPONSABILIDADE: IMPLICA«’ES NA BIO…TICA E NA PESQUISA CIENTÕFICA;JAIR JOSÈ MALDANER, MATEUS  MATOS DOS SANTOS;IFTO;CI NCIAS HUMANAS;BANNER
11215;BANCO DA QUÌMICA: UM JOGO AMBIENTAL;LOURDES  PAIX„O SANTOS, LUIZ  GUMES LOPES, PINTO  ALBUQUERQUE MELO, ROBERTO  BONAPARTE NETA, KAROLINY  MELO SANTOS;IFS;CI NCIAS EXATAS E DA TERRA;ORAL
11208;MELHORIA DO DESENVOLVIMENTO URBANO DO MUNICÕPIO DE PICUÕ: UM ENFOQUE NA REDU«√O DE PERDAS ATRAV…S DO PLANEJAMENTO E CONTROLE DE OBRAS;CAMILA CAMPOS GÛMEZ FAM·, JOSENILDO MEDEIROS DE OLIVEIRA J˙NIOR, JOSEPH HAKKINEN ALVES SANTOS, LOURENÁO NETO DE MEDEIROS DANTAS, ÕTALO DE LIMA PORTO;IFPB;ENGENHARIAS;BANNER
11194;UMA PROPOSTA DE UM M…TODO DE ENSINO INTERDISCIPLINAR NO ESTUDO DAS EQUA«’ES DIFERENCIAIS EM CURSOS DE ENGENHARIA;BRUNO OLIVEIRA DOS ANJOS, GISLAN SILVEIRA SANTOS, MATHEUS DUTRA BRASIL, M·RCIO OLIVEIRA MATOS;IFBA;ENGENHARIAS;BANNER
11192;AN¡LISE DA PERCEP«√O DOS ALUNOS EM RELA«√O AOS SERVI«OS OFERTADOS PELA COORDENA«√O DE EST¡GIO DE UMA IES*/JP;KAROLAINY DO NASCIMENTO GONÁALVES;IFPB;CI NCIAS SOCIAIS APLICADAS;BANNER
11190;ARQUITETURA DE COMUNICA«√O VIA INTERNET COM PROTOCOLO MQTT APLICADA ¿ ROB”TICA M”VEL;F·BIO ARA˙JO DE LIMA, GUSTAVO PEREIRA BRUNO, NATANAEL QUEIROZ DE OLIVEIRA, RAPHAELL  MACIEL DE SOUSA;IFPB;ENGENHARIAS;BANNER
11188;PROXIMA B: SER¡ ESSA NOSSA NOVA TERRA?;SIMONY  MARTINS;IFPE;CI NCIAS EXATAS E DA TERRA;BANNER
11187;INCID NCIA DE DOEN«AS FOLIARES EM CANA-DE-A«⁄CAR;ALINE SILVA SANTOS, DANIELLE COELHO SANTOS, DARLEY OLIVEIRA CUTRIN, LUCIANE RODRIGUES NOLETO, WARLY SANTOS PIRES;IFTO,  OUTROS;CI NCIAS AGR¡RIAS;BANNER
11183;DIAGN”STICO E ORIENTA«’ES DAS BOAS PR¡TICAS DE FABRICA«√O NO BENEFICIAMENTO DE CASTANHA DE CAJU DO MUNICÕPIO DE CERRO COR¡/RN;ODISSÈIA CARLA PIRES GASPARETO;IFRN;CI NCIAS AGR¡RIAS;BANNER
11179;ASPECTOS QUALITATIVOS DA ARBORIZA«√O DOS BAIRROS DA ZONA SUL DO MUNICÕPIO DE ITACOATIARA, AMAZONAS;ANA RITA DE OLIVEIRA BRAGA;IFAM;MULTIDISCIPLINAR;BANNER
11178;CARACTERIZAÁ„O DO CONSUMIDOR DE MEL NA CIDADE DE GURUPI;LUANA VEN¬NCIO DA COSTA;IFTO;MULTIDISCIPLINAR;BANNER
11177;AFERI«√O EXPERIMENTAL DA MASSA TERRESTRE POR MEIO DE EQUA«’ES DO P NDULO PARA PEQUENAS OSCILA«’ES;ARTHUR DE ARANDAS RAMOS DINIZ, DR. ALLYSSON MAC·RIO DE ARA˙JO CALDAS, LUCAS LOPES DA SILVA SANTOS, PEDRO HENRIQUE DE MORAIS MARTINS, RODRIGO ERNESTO ANDRADE SILVA;IFPB;CI NCIAS EXATAS E DA TERRA;BANNER
11174;A MODELAGEM MATEM¡TICA COMO ESTRAT…GIA DE ENSINO APRENDIZAGEM NO ENSINO FUNDAMENTAL: EXPERI NCIA VIVENCIADA EM UMA ESCOLA MILITAR DE RORAIMA;ADNELSON JATI BATISTA, NILRA JANE FILGUEIRA BEZERRA, ROSELI BERNARDO SILVA DOS SANTOS, SEBASTI„O DA SILVA MALAQUIAS;IFRR;CI NCIAS HUMANAS;ORAL
11169;O EFEITO DA PROPAGANDA NAS MICRO E PEQUENAS EMPRESAS: UM ESTUDO DE CASO NA CIDADE DE PINHEIRO - MA;CÈSAR  LIMA, SILVESTRE  J˙NIOR, WILLIAM  QUEZADO;IFMA;CI NCIAS SOCIAIS APLICADAS;BANNER
11168;ESTUDO GEOL”GICO DE UMA ¡REA SITUADA A OESTE DO MUNICÕPIO DE JAGUARETAMA NO ESTADO DO CEAR¡;ALEXSANDRO DOS SANTOS GARCES, CÈZAR HENRIQUE BARRETO, NAEDJA VASCONCELOS PONTES, TALITA FERNANDA CARVALHO GENTIL, VINICIUS IGOR ALBUQUERQUE BATISTA DE ARA˙JO;IFBA,  UFC,  UFCG,  UFS;CI NCIAS EXATAS E DA TERRA;ORAL
11167;OBST¡CULOS APRESENTADOS POR ESTUDANTES NA PRODU«√O DISSERTATIVA;IZABELLA  ALVES PERINI;IFTO;LINGUÕSTICA, LETRAS E ARTES;BANNER
11162;SISTEMA DE ARMAZENAMENTO WEB DE BAIXO CUSTO UTILIZANDO A ESP8266;ILTON  BARBACENA, LUCAS SOUSA FEITOSA, SAMMARA RAQUEL VILAR, TAIRONE MAMEDE DA SILVA FERNANDES;IFPB;ENGENHARIAS;BANNER
11161;F”SFORO REMANESCENTE EM SEIS SOLOS REPRESENTATIVOS DO SERID” PARAIBANO;JANDEILSON ALVES DE ARRUDA, JOAB JOSEMAR VITOR RIBEIRO DO NASCIMENTO, JOSÈ LUCÌNIO DE OLIVEIRA FREIRE, JOSÈ WELLINGTON DE MEDEIROS ESTRELA, SEBASTIANA JOELMA DE AZEVEDO SANTOS;IFPB;CI NCIAS AGR¡RIAS;BANNER
11160;ALGORITMO SEGUIDOR DE FACES PARA UM ROB‘ QUADR⁄PEDE;ISABEL  FROTA;IFCE;CI NCIAS EXATAS E DA TERRA;ORAL
11157;PROCESSO ENSINO APRENDIZAGEM PELO VI…S DO CURRICULO INTEGRADO E A FORMA«√O PARA A CIDADANIA;MAIZE SOUSA VIRGOLINO DE ARA˙JO;IFPB;CI NCIAS HUMANAS;ORAL
11154;O SCRATCH E O ENSINO DE PROGRAMAÁ„O PARA CRIANÁAS COM SÌNDROME DE ASPERGER.;ANDREIA  PINHEIRO DOS SANTOS SILVA, JAQUELINE  OLIVEIRA;IFBA;CI NCIAS EXATAS E DA TERRA;BANNER
11151;ESTUDO COMPARATIVO DA ESTABILIDADE TÈRMICA DA GALACTOMANANA E DA BLENDA GALACTOMANANA/ QUITOSANA;RÙMICY  DERMONDES SOUZA;UFMA;CI NCIAS EXATAS E DA TERRA;BANNER
11143;AN¡LISE DA ADEQUA«√O DOS CANTEIROS DE OBRA DO MUNICÕPIO DE PICUÕ-PB ¿ NORMA NR-18;CAMILA CAMPOS GÛMEZ FAM·, HYSLA DAYANE ANGELO DE SOUSA, JOSEPH HAKKINEN ALVES SANTOS, JOSÈ CÈSAR GOMES DANTAS, LOURENÁO NETO DE MEDEIROS;IFPB;ENGENHARIAS;BANNER
11139;REFLEXOES SOBRE O ENSINO DA LÕNGUA ESPANHOLA NA ESCOLA CICERO VIERIA NETO ñ PACARAIMA: UM OLHAR SOBRE A ESCOLA NA FRONTEIRA;ADRIANA  ALVES DA SILVA;IFRR;LINGUÕSTICA, LETRAS E ARTES;BANNER
11138;PANORAMA DA PRODU«√O DE LARANJA NO BRASIL;ANDREIA  BRAND„O DE MELO LOPES RÍGO, EDUARDO  CARVALHO DIAS, JOABE  CARDOSO NUNES DA SILVA, PIETRO  LOPES REGO;IFTO,  OUTROS;CI NCIAS AGR¡RIAS;BANNER
11137;DESEMPENHO DE CORDEIROS MESTIÁOS DE MORADA NOVA E SANTA INÍS AO NASCER;PALOMA PRISCILA COSTA  JESUS;IFRN;CI NCIAS AGR¡RIAS;BANNER
11130;O PAPEL DO PROFESSOR NA INTERA«√O VERBAL EM UMA SALA DE AULA VIRTUAL;NEILSON  ALVES DE MEDEIROS, SAMARA  DA SILVA GOMES;IFPB;LINGUÕSTICA, LETRAS E ARTES;BANNER
11128;GERENCIAMENTO DE PNEUS INSERVIVEIS: ESTUDO DE CASO DAS BORRACHARIAS LOCALIZADAS NO CENTRO DE CORRENTE-PI;JHESYKA MORGANY PINHEIRO MACIEL, JULIO CESAR  RIBEIRO, MARCÌLIA MARTINS DA SILVA;IFPI;MULTIDISCIPLINAR;BANNER
11127;USO DE REJEITO DE BRITA NA COMPOSI«√O DA MASSA PARA CER¬MICA BRANCA;DANTE LIMA FERNANDES, LUIZ FELIPE NÛBREGA, MARCONDES MENDES SOUZA, YURI SOUZA GOMES;IFRN;ENGENHARIAS;BANNER
11124;ESTUDO DO DESENVOLVIMENTO DE ATRIPLEX NUMMUL·RIA CULTIVADA EM DIFERENTES SUBSTRATOS;FRANCISCO AURICIO NOGUEIRA DE SOUZA, PRISCILA DA SILVA DOS SANTOS, REINALDO FONTES CAVALCANTE;IFCE;CI NCIAS AGR¡RIAS;BANNER
11120;COMPORTAMENTO CROMOSS‘MICO DE CAPSICUM ANNUUM DURANTE A MEIOSE;CREUCI MARIA CAETANO, GISELE RENATA CASTRO, VIVIANE  SOUZA MACEDO, YURI MARIA GARZÛN BAUTISTA;IFRO,  OUTROS,  UNAL;CI NCIAS BIOL”GICAS;BANNER
11119;ILHAS DE RACIONALIDADE NO CONTEXTO DA ALIMENTA«√O DOS ADOLESCENTES: UMA PERSPECTIVA METODOL”GICA NO ENSINO DE QUÕMICA;ADRIANA ROCHA SILVA, CARLA SABRINA JORGE, ENDRIGO CARLOS MARQUES, LEIDIANE PEREIRA SILVA, SUZANA OLIVEIRA PAIVA;IFPI;CI NCIAS HUMANAS;BANNER
11117;QUALIDADE NO ATENDIMENTO DA ADMINISTRA«√O P⁄BLICA: ESTUDO DE CASO NO INSTITUTO NACIONAL DE SEGURO SOCIAL - INSS NO MUNICÕPIO DE PORTO VELHO-RO;MARIA GENILDA BATISTA SILVA;IFRO;CI NCIAS SOCIAIS APLICADAS;BANNER
11115;AN¡LISE DOS PRINCIPAIS PROBLEMAS CONSTRUTIVOS DECORRENTES DE FALHAS DE PROJETO - ESTUDO DE CASO EM MACEI”, AL.;FLAVIANA SILVA CORREIA;IFAL;ENGENHARIAS;BANNER
11114;PROGRAMA 5S: UM ESTUDO DE CASO NA GEST√O DE ESTOQUE NA EMPRESA ARPLAN ENGENHARIA;ANE LOURENÁO DE MEDEIROS, FRANCISCA CARLOS DA SILVA, LUCIANA GUEDES SANTOS, RODRIGO AUGUSTO DA SILVA PIMENTEL, THIAGO RODRIGO MEDEIROS PEREIRA;IFRN;CI NCIAS SOCIAIS APLICADAS;BANNER
11108;TABULEIRO BRAILLE: VENDO A MATEM¡TICA COM AS M√OS;YARA  LORRANE;IFAP;CI NCIAS HUMANAS;BANNER
11105;PERFIL NUTRICIONAL DE ADOLESCENTES DO MUNICÕPIO DE MORADA NOVA;CELSO LOURENÁO ARRUDA, EVERL‚NDIA SILVA MOURA, JÈSSICA ARA˙JO FREITAS, LORENA LIMA MONTEIRO, LUANA SOUSA FREITAS;IFCE;CI NCIAS DA SA⁄DE;BANNER
11103;QUANTIFICA«√O DA SEDIMENTA«√O E EROS√O DAS PRAIAS DA BARREIRA DO INFERNO E DE COTOVELO, LITORAL SUL DE NATAL/RN;LE„O XAVIER DA COSTA NETO, RAISSA  FRANCICLEIDE;IFRN;CI NCIAS EXATAS E DA TERRA;BANNER
11102;GOOGLE EARTH COMO FERRAMENTA PARA O ENSINO-APRENDIZAGEM DE GEOGRAFIA;SILVANA  SILVA;IFPA;CI NCIAS HUMANAS;BANNER
11098;BARRAGEM DE ATALAIA: VEM-SE A ¡GUA, V√O-SE AS MEM”RIAS;JEIEL SOUSA BRITO, LAURENICE SEVERINA DA COSTA, LAÈCIO BARROS DIAS;IFPI;CI NCIAS HUMANAS;BANNER
11097;EXPERI NCIAS COM EDUCA«√O EMPREENDEDORA EM JO√O C¬MARA;ANA FL·VIA DE LIMA, MARIA LUIZA AZEVEDO CARVALHO, VANESSA  DESIDERIO;IFRN;CI NCIAS SOCIAIS APLICADAS;BANNER
11092;AVALIA«√O P”S-OCUPA«√O DE UNIDADES HABITACIONAIS DO CONJUNTO ANT‘NIO MARIZ, CAMPINA GRANDE-PB.;ANA PAULA SANTOS FERREIRA, BRENDO ARA˙JO SENA, BRUNA XAVIER TRAVASSOS, L·ZARO ABREU SILVA, MELLYNE PALMEIRA MEDEIROS;IFPB;ENGENHARIAS;BANNER
11088;A IMPORT¬NCIA DE UM LABORAT”RIO DE MATEM¡TICA NO ENSINO;ORBILIA DA SILVA BARBOSA DE FRAN«A;IFPI;CI NCIAS EXATAS E DA TERRA;BANNER
11086;CARACTERIZA«√O DE RESÕDUOS ”SSEOS DE FRANGO;F·BIO  LIMA CAVALCANTE, MEN DE S·  MORREIRA DE SOUZA FILHO, MOACIR  RODRIGUES, PAULA BIANCA  VIANA PINHEIRO;IFCE,  OUTROS;ENGENHARIAS;ORAL
11085;O ESPAÁO URBANO DE MACAÌBA-RN: UMA REVIS„O BIBLIOGR·FICA;JUAN MULLER DE ANDRADE BANDEIRA;IFRN;CI NCIAS HUMANAS;BANNER
11084;PLANEJAMENTO E GEST√O: (RE) PENSANDO O PAPEL DOS PLANOS DIRETORES URBANOS;SILVANA  SILVA;IFPA;CI NCIAS HUMANAS;BANNER
11083;USO E DISSSEMINA«√O DA TECNICA AGROECOL”GICA DE COMPOSTAGEM, PARA ADUBA«√O EM HORTAS ORGANICAS DENTRO DA ESCOLA TOBIAS BARRETO EM OLIVEIRA DOS BREJINHOS-BA;CARLOS ERNANI ERNANI BORTO BOGES;IFBA;CI NCIAS AGR¡RIAS;BANNER
11074;ATRIBUTOS FÕSICOS DO SOLO CULTIVADO SOB BANANAL FERTILIZADO COM ORGANOMINERAL;JAIRO COSTA COSTA FERNANDES, JEOZADAQUE RODRIGUES RODRIGUES DONATO, YAGO C‚NDIDO C‚NDIDO PEREIRA DA SILVA;IFBA;CI NCIAS AGR¡RIAS;BANNER
11073;AVALIA«√O DA EFIC¡CIA DO PROGRAMA PROJOVEM CAMPO NO MUNICIPIO DE CHAPADINHA, MARANH√O;ANA CLAUDIA LEAL DE SOUSA, MARIA VERONICA  MEIRA DE ANDRADE;IFMA;CI NCIAS HUMANAS;BANNER
11072;MODELAGEM 3D: RESGATE FORMAL E TEMPORAL DA  CATEDRAL DA S… DE OLINDA;ELTON RUBENS VIEIRA, LIDIANE DAYANE SANTOS, NELCY MAGDALA MOURA SANTOS, PAULO FERNANDO DIAS DINIZ;IFPE;MULTIDISCIPLINAR;BANNER
11060;CONTROLE AUTOM¡TICO DE ALIMENTA«√O ANIMAL;JO„O VITOR DE SANTANA OLIVEIRA, PATRÌCIA NEVES DE MEDEIROS, TAIN· MOTA DA SILVA MELO, VITOR OT·VIO SILVA TEIXEIRA DE SOUZA, ÕTALO SOUZA SANTOS;IFBA,  OUTROS;ENGENHARIAS;BANNER
11058;TRANSTORNO DE ANSIEDADE GENERALIZADA (TAG);MABIA ALVES ALVES;IFTO;CI NCIAS DA SA⁄DE;BANNER
11056;DIVERG NCIA E SELE«√O DE CANA-DE-A«⁄CAR COM POTENCIAL FORRAGEIRO;ALINE SILVA SANTOS, DANIELLE COELHO SANTOS, DARLEY OLIVEIRA CUTRIN, JO„O MAYCON DA SILVA TORZECKI, LUCIANE RODRIGUES NOLETO;IFTO;CI NCIAS AGR¡RIAS;BANNER
11053;O USO DA TRANSPOSI«√O DID¡TICA COMO MEDIADORA DA APLICA«√O DE MATERIAIS MANIPUL¡VEIS NO ENSINO DE TRIGONOMETRIA;ADNELSON JATI BATISTA, DANNYELE CRISTIANE DE ALMEIDA SILVA, MAGNO PERREIRA DE OLIVEIRA SILVA, NILRA JANE FILGUEIRA BEZERRA;IFRR;CI NCIAS HUMANAS;BANNER
11052;CARACTERIZA«√O DOS METAPLASMOS PRESENTES NAS PRODU«’ES TEXTUAIS ESCRITAS DE ALUNOS DO 4∫ ANO DO ENSINO T…CNICO INTEGRADO AO M…DIO DO IFPI CAMPUS PIRIPIRI;CAROLINE SILVA FERREIRA, JORGELENE DE SOUSA LIMA, NATH·LIA MARIA LOPES DIAS, VALDÌVIA REGINA MEDEIROS QUEIROZ;IFPI;LINGUÕSTICA, LETRAS E ARTES;ORAL
11051;ESTIMATIVA DA EVAPOTRANSPIRA«√O DE REFER NCIA UTILIZANDO DADOS LIMITADOS PARA MACEI”-AL;ANNA  HOZANA FRANCILINO, FRANCISCO  DIRCEU DUARTE ARRARES, JUAREZ  CASSIANO DE LIMA JUNIOR, KLEBER  GOMES DE MACÍDO, WILLAME  CANDIDO DE OLIVEIRA;IF SERT√O-PE,  IFCE,  UFC,  UFRPE;CI NCIAS AGR¡RIAS;BANNER
11050;VIABILIZA«√O DA UTILIZA«√O DE RESÕDUOS DE PNEU PARA BLOCOS DE CONCRETO INTERTRAVADO;CONCEIÁ„O DE MARIA PINHEIRO CORREIA, GUSTAVO HENRIQUE DE ALMEIDA MATOS, PÈRICLES RAFAEL PAV„O CARVALHO, WANESSA KAROLINE MACIEL CARVALHO;IFMA;ENGENHARIAS;BANNER
11044;ESTUDO TE”RICO DA ADSOR«√O DE HIDROCARBONETOS  LEVES NA MOF CU-BTC;ADRIANO  LIMA, GLEICE MARA OLIVEIRA SILVA, LUCAS CRUZ PIMENTEL;IFCE;CI NCIAS EXATAS E DA TERRA;ORAL
11043;EGRESSOS DO CURSO DE TECNOLOGIA EM CONSTRU«√O DE EDIFÕCIOS: AN¡LISE DO PERFIL PROFISSIONAL E DO PROCESSO DE FORMA«√O;EMMANUELLA  FLORA AMARAL BARBOSA DE OLIVEIRA, JO„O ALEXANDRE  PEREIRA DE SOUZA, KALINE  SILVA CASTRO, VILSON  LACERDA BRASILEIRO JUNIOR;IFPB;CI NCIAS HUMANAS;BANNER
11040;TRADU«√O AUDIOVISUAL E O ENSINO DE ELE;SONIA MARIBEL  MUÒOZ CROVETO;IFBA;LINGUÕSTICA, LETRAS E ARTES;ORAL
11035;ESTUDO FINANCEIRO DOS MORICULTORES DE VALLE DEL CAUCA: REGI√O CENTRO - COL‘MBIA;RIANE  SOUZA CABRAL, SAMUEL  DOS SANTOS JUNIO;IFRO;CI NCIAS SOCIAIS APLICADAS;BANNER
11029;C¡LCULO E AN¡LISE DE RUÕDO AUDÕVEL EM LINHAS A…REAS DE TRANSMISS√O DE ENERGIA EL…TRICA;ALEXSANDRO ALEIXO PEREIRA DA SILVA, JOSELITO SILVA DE SOUZA, JOSÈ MORAES GURGEL NETO, MAX LUAN QUIDUTE DE MELO, REGINA MARIA LIMA NETA;CESMAC;ENGENHARIAS;BANNER
11028;PLANEJAR, INVESTIR E REALIZAR: O CASO DAS NOIVAS EM JO√O PESSOA;LARISSA LIRA GUIMAR„ES, REBECA CORDEIRO DA CUNHA ARA˙JO, RICARDO JOSÈ  FERREIRA;IFPB;CI NCIAS SOCIAIS APLICADAS;BANNER
11022;O TERCEIRO SETOR COMO EXECUTOR DE POLÕTICAS P⁄BLICAS SOCIAIS NA CONSTRU«√O DO DESENVOLVIMENTO JUSTO E SOLID¡RIO;ALAN  SILVA;UESPI;CI NCIAS SOCIAIS APLICADAS;BANNER
11021;A EDUCA«√O INCLUSIVA E A FORMA«√O DOCENTE: UM ESTUDO DE CASO DA ESCOLA ESTADUAL PROFESSORA MARIA DE LOURDES BEZERRA, DO MUNICÕPIO DE MACAU/RN.;FRANCISCA DOS SANTOS PIMENTEL, LILIAN DA SILVA VIEIRA, MARIA APARECIDA DOS SANTOS FERREIRA, MARIA DEISE RODRIGUES DA SILVA, RAMON IGOR DA SILVEIRA OLIVEIRA;IFRN;MULTIDISCIPLINAR;BANNER
11019;APLICA«√O DE FIBRA DE COCO IMPREGNADA COM NÕQUEL PARA ADSOR«√O DE COMPOSTOS SULFUROSOS DISSOLVIDOS EM COMBUSTÕVEIS;CÌCERO  PESSOA DE MOURA, JAQUELINE  DE LIMA NASCIMENTO, NAPOLE„O  EVANGELISTA PEREIRA DA SILVA;IFCE;CI NCIAS EXATAS E DA TERRA;ORAL
11017;TECNOLOGIA DE FABRICA«√O DO IOGURTE INTEGRAL COM COL¡GENO SABOR ACEROLA;KARLATEREZINHA GOLLNER REIS, KATIANE DA SILVA MENDONÁA;IFAL;CI NCIAS AGR¡RIAS;BANNER
11013;AS (RE) SIGNIFICAÁıES CULTURAIS DO CARRO DE BOI NO SERT„O DAS ALAGOAS;COSME  ROGÈRIO FERREIRA;IFAL;CI NCIAS HUMANAS;BANNER
11012;PERFIL DAS INSTALA«’ES DE PRODUTORES DE SUÕNOS NA MICRORREGI√O DA V¡RZEA NO MUNICÕPIO DE APODI-RN;ANA VITÛRIA LUCENA MORAIS, BRUNA THALIA SILVEIRA SABINO, FAVIANO  MOREIRA;IFRN;CI NCIAS AGR¡RIAS;BANNER
11010;CICLOPE: APLICATIVO MÛVEL PARA ALERTA DE RISCO DE ENCHENTES;GLAUCO  B. DE SOUSA, IVO SÛCRATES  MORAES DE OLIVEIRA, LETÌCIA  RIBEIRO P. DE OLIVEIRA, THATIANE  DE OLIVEIRA ROSA;IFTO,  USP;CI NCIAS EXATAS E DA TERRA;BANNER
11001;SUSTENTABILIDADE: UMA AN¡LISE DA IMPLANTA«√O DA LOGÕSTICA REVERSA APLICADA AS FOLHAS DE OFÕCIO NO IFRN CAMPUS NOVA CRUZ COMO FORMA DE REDUZIR A EMISS√O DE RESÕDUOS S”LIDOS;CÌCERO  NIC·CIO DA COSTA J˙NIOR;IFRN;ENGENHARIAS;BANNER
11000;CONSTRU«√O DE UM KIT DID¡TICO PARA AULAS PR¡TICAS DE FUNDI«√O;ELVIO PRADO DA SILVA, GEOVANE SANTOS OLIVEIRA, MARCUS VINÌCIUS PASCOAL RAMOS;IFBA;ENGENHARIAS;BANNER
10994;SISTEMA DE PRODUÁ„O ORG‚NICA NO P. A. MARING·, ARAGUATINS - TO;GUILHERME OCTAVIO DE SOUSA SOARES, JOSÈ LUCAS DE SOUSA SOARES, MÙNICA SANTANA DA SILVA, PALOMA CASTRO ABREU, SÈRGIO ALVES DE SOUSA;IFTO;CI NCIAS AGR¡RIAS;BANNER
10993;A INFLU NCIA DOS PROFESSORES COM EXPERI NCIA PROFISSIONAL EXTERIOR AO MAGIST…RIO SUPERIOR NA INTEN«√O EMPREENDEDORA DE ESTUDANTES DE ADMINISTRA«√O;BARROS BARROS MORAIS, BRENO MACEDO RÍGO, ELIDA SILVA COSTA, ELLEN FONSÍCA SILVA, MISSIAS LOPES SOUSA;IFMA;CI NCIAS SOCIAIS APLICADAS;BANNER
10992;ESTUDO DA VIABILIDADE PARA IMPLANTA«√O DE M…TODO DE RECOLHIMENTO, REAPROVEITAMENTO, ENCAMINHAMENTO E DESCARTE CORRETO DE LIXO ELETR‘NICO EM EMPRESAS DE BOA VISTA - RR;IANNE LOUISE BEZERRA RAMALHO;IFRR;CI NCIAS BIOL”GICAS;BANNER
10990;OBJETIFICA«√O DA MULHER EM PROPAGANDAS;HIRLARY NAKAGAICHE DE LIMA ROBERTO, JOSÈ DIEGO DOS SANTOS CIRNE, KALIANE SOARES C‚MARA;IFRN;LINGUÕSTICA, LETRAS E ARTES;BANNER
10987;TOXICIDADE AGUDA DO HERBICIDA GLIFOSATO PARA JUVENIS DE TAMBAQUI;ELIANDO PICANÁO TENAÁOL, FRANCISCO XAVIER NOBRE, KALYSON DE SOUZA MARTINS, MARCIO QUARA DE CARVALHO SANTOS;IFAM;CI NCIAS AGR¡RIAS;ORAL
10985;DOTA«’ES OR«AMENT¡RIAS DO INSTITUTO FEDERAL DE EDUCA«√O, CI NCIA E TECNOLOGIA DO RN/CAMPUS MACAU EM 2015, VALORES E GESTORES.;CARLOS JOSÈ  ARAUJO DA SILVA, MARIA APARECIDA  DOS SANTOS FERREIRA, MICHAEL PRATINI  SILVA DE SOUZA;IFRN;CI NCIAS HUMANAS;BANNER
